tweet_time,tweet_id,username,tweet_text,source,favourite,retweet,clean
5/3/2020 22:11,1.25696E+18,Gigih_SY,@alfizinarf Dari semua aplikasi ke digital money saya cuman 2 tokped dan bukalapak yg kenaÅEÅE§¶ÅEÄÅEÅEÅEÅE,Twitter for Android,0,0,dari semua aplikasi ke digital money saya cuman 2 tokped dan bukalapak yg kena
5/3/2020 22:11,1.25696E+18,BukaBantuan,Hai kak. @andiniprbwt maaf bikin kakak gak nyaman ya. Yuk silakan infokan secara detail kendala kakak di inbox ya agar Bella bantu untuk pengecekan ya kak beserta alamat email dan nomor telepon yang terdapat di akun Bukalapak ya. Bella tunggu di inbox :) ^WS,Ivosights - Sociomile,1,0,hai kak maaf bikin kakak gak nyaman ya yuk sila info cara detail kendala kakak di inbox ya agar bella bantu untuk kece ya kak serta alamat email dan nomor telepon yang dapat di akun bukalapak ya bella tunggu di inbox ws
5/3/2020 22:11,1.25696E+18,goujiien,@imanarif_syaif Dijual di tokped atau bukalapak?,Twitter for Android,0,0,jual di tokped atau bukalapak
5/3/2020 22:10,1.25696E+18,wherda,"@3ndi @bukalapak @canva Sebelumnya ud gw ganti sih, wkt ad semacam penipu yg gw ajak chat trus gw laporin",Twitter for iPhone,0,0,belum ud gw ganti sih wkt ad macam tipu yg gw ajak chat trus gw laporin
5/3/2020 22:10,1.25696E+18,3TSALIS,Bukalapak karo Canva ku tau dibreach coy wtf,Twitter for Android,0,0,bukalapak karo canva ku tau dibreach coy wtf
5/3/2020 22:10,1.25696E+18,ayahnyafaris_id,"Alhamdulillah... Semenjak banyak Mall ditutup, isteri jarang ke Mall. Bahkan sekarang banyak tamu yg silaturrohim ke rumah. Assalamualaykum... pakeeeeeet..! *kurir shopee, tokped &amp; bukalapak",Twitter for Android,1,0,alhamdulillah semenjak banyak mall tutup isteri jarang ke mall bahkan sekarang banyak tamu yg silaturrohim ke rumah assalamualaykum pakeeeeeet kurir shopee tokped amp bukalapak
5/3/2020 22:10,1.25696E+18,BukaBantuan,"@3ndi Hai Kak. Kami informasikan, bahwa kami selalu meningkatkan sistem keamanan di Bukalapak, dan memastikan data-data penting pengguna tidak disalahgunakan. Untuk itu kami himbau kakak dapat memperhatikan keamanan saat bertra.. https://t.co/9LVUd6bCqM",Ivosights - Sociomile,0,0,hai kak kami informasi bahwa kami selalu tingkat sistem aman di bukalapak dan pasti datadata penting guna tidak disalahgunakan untuk itu kami himbau kakak dapat perhati aman saat tra
5/3/2020 22:09,1.25696E+18,piksadewi,"@asnamaulian @cogitoergocum_ @IvanSsnto11 @fuaaaadss @secgron @bukalapak Eh sama, saya juga bukalapaknya.. Terus gimana? https://t.co/Skl6eHWAyT",Twitter for Android,0,0,eh sama saya juga bukalapaknya terus gimana
5/3/2020 22:09,1.25696E+18,3ndi,@wherda @bukalapak @canva Udah cek?,Twitter for Android,0,0,udah cek
5/3/2020 22:08,1.25696E+18,lilfoopy,"@audryan_belle @AdiUswanto Sama gue juga bukalapak , tanggal sama bulan taun juga sama",Twitter for Android,0,0,sama gue juga bukalapak tanggal sama bulan taun juga sama
5/3/2020 22:08,1.25696E+18,nika_desu,"@estehtawar_ Araseo ÅEÅEÅEÅE bukalapak aku kena. Pas aku coba ganti password bisa, eh ganti email gbs. Njuk kudu piye? ÅEÅEÅEÅEÅEÅEÅEÅEÅEÅEÅEÅE",Twitter for iPhone,0,0,araseo bukalapak aku kena pas aku coba ganti password bisa eh ganti email gbs njuk kudu piye
5/3/2020 22:08,1.25696E+18,rinariris99,"Nana dan inspirasi membangun usaha online, channel youtube revolusi nekad bangkitkan semangatnya keren  #Tokopedia  #bukalapak  #PakeLinkAja  #orangkayagatau  https://t.co/8Gxa5vGITp",Twitter for Android,0,0,nana dan inspirasi bangun usaha online channel youtube revolusi nekad bangkit semangat keren
5/3/2020 22:08,1.25696E+18,wherda,"@3ndi @bukalapak @canva So far blm sih, jgn sampe d..",Twitter for iPhone,0,0,so far blm sih jgn sampe d
5/3/2020 22:08,1.25696E+18,paksierlangga1,"@agusyasin_83 @kumparan @bukalapak Sama bro, tapi kok gk ada kejadian aneh sama akunku setahun ini, wajar wajar aja",Twitter for Android,0,0,sama bro tapi kok gk ada jadi aneh sama akun tahun ini wajar wajar aja
5/3/2020 22:07,1.25696E+18,JossYusuf,16 inch atau 40 cm  25.000/psg ready 15.000 Langsung saja klik di bukalapak pakai jne trucking. --- Sarung Tangan Karet 16 inch Tebal via @bukalapak https://t.co/mnMPopuAsj https://t.co/CIDGwGUA4g,Twitter for Android,0,0,16 inch atau 40 cm 25000psg ready 15000 langsung saja klik di bukalapak pakai jne trucking sarung tangan karet 16 inch tebal via
5/3/2020 22:07,1.25696E+18,3ndi,"@wherda @bukalapak @canva Lagi ada pencurian data Da, besar-besaran. Cek email¬≤ lu kerampok gak datanya",Twitter for Android,0,0,lagi ada curi data da besarbesaran cek email lu rampok gak data
5/3/2020 22:07,1.25696E+18,mid0ura,@abraxastupefy @abangqu lahhh???? enggg coba mau lewat bukalapak??? ditempatku malah vol suka lompat2 jadi kdg nyari nya numpang kota sebelah lol,Twitter for Android,0,0,lahhh enggg coba mau lewat bukalapak tempat malah vol suka lompat2 jadi kdg nyari nya numpang kota belah lol
5/3/2020 22:06,1.25696E+18,taufikdimitri,@fuzzzuf Aku juga cup sama bukalapak,Twitter for Android,0,0,aku juga cup sama bukalapak
5/3/2020 22:06,1.25696E+18,nicholasglennd,"@amandanormanita justru pass gua leaked dr tokopedia, shopee, ama bukalapak gilak wkwk",Twitter Web App,0,0,justru pass gua leaked dr tokopedia shopee ama bukalapak gilak wkwk
5/3/2020 22:06,1.25696E+18,wi_rudy,@bukalapak Skr sy mau tny knp transaksi nya dibatalin sepihak sama @bukalapak ?,Twitter Web App,0,0,skr sy mau tny knp transaksi nya dibatalin pihak sama
5/3/2020 22:05,1.25696E+18,dimasku,"Baca replay di tweet ini, yang mention Bukalapak cuma 1 orang ÅEÅEÅE≠  Top alternatif pengganti Tokopedia:  1. Shopee 2. Blibli 3. Lazada https://t.co/U0uMNxCpmz",Twitter Web App,0,0,baca replay di tweet ini yang mention bukalapak cuma 1 orang top alternatif ganti tokopedia 1 shopee 2 blibli 3 lazada
5/3/2020 22:03,1.25696E+18,wherda,@3ndi @bukalapak @canva How come?,Twitter for iPhone,0,0,how come
5/3/2020 22:03,1.25696E+18,jevivera,Tahun 2018 di Bukalapak! Hla aku ki transaksi opo yo?,Twitter for Android,0,0,tahun 2018 di bukalapak hla aku ki transaksi opo yo
5/3/2020 22:03,1.25696E+18,BukaBantuan,@hillmyams Sama-sama Kak. Jika masih ada pertanyaan seputar Bukalapak silakan hubungi Bella kembali ya. Selalu jaga kesehatan ya Kak. :) ^MA,Ivosights - Sociomile,0,0,samasama kak jika masih ada tanya putar bukalapak sila hubung bella kembali ya selalu jaga sehat ya kak ma
5/3/2020 22:02,1.25696E+18,melamaull,@wupihsirsik @tokopedia @canva @bukalapak Canva juga dong ya :') malah udah sedari lamaa,Twitter for Android,0,0,canva juga dong ya malah udah dar lamaa
5/3/2020 22:01,1.25696E+18,thebeatlessucks,pass bukalapak gua anjing!,Twitter for iPhone,0,0,pass bukalapak gua anjing
5/3/2020 21:59,1.25696E+18,ginarizqillah,@hanarmdhn Bukalapak ama tokped gua kena wkwkwk syial dubsmash gua liat2 emang pada kena juga yak,Twitter for Android,0,0,bukalapak ama tokped gua kena wkwkwk syial dubsmash gua liat2 emang pada kena juga yak
5/3/2020 21:58,1.25696E+18,azaliaavvd,@fuaaaadss @secgron @bukalapak Buka ini gmn si kak,Twitter for Android,0,0,buka ini gmn si kak
5/3/2020 21:57,1.25696E+18,agusyasin_83,"@kumparan akun bukalapak ku kebobol, setahun yg lalu  gimananih tanggung jawab dari @bukalapak",Twitter for Android,0,0,akun bukalapak ku bobol tahun yg lalu gimananih tanggung jawab dari
5/3/2020 21:57,1.25696E+18,cokelatbutir,"@Mutiaradwr bukalapak bakal email km kalo ada percobaan login ke akun bukalapakmu. tp inikan kasusnya bkn pembobolan, tp pencurian",Twitter for Android,0,0,bukalapak bakal email km kalo ada coba login ke akun bukalapakmu tp ini kasus bkn bobol tp curi
5/3/2020 21:56,1.25696E+18,Don_Arturo11,Kenapa ga ngelamar jadi tim IT bukalapak atau tokped saja kalau mungkin merasa berkompeten dalam bidang tersebut.  Hahahaha,Twitter for Android,0,0,kenapa ga ngelamar jadi tim it bukalapak atau tokped saja kalau mungkin rasa kompeten dalam bidang sebut hahahaha
5/3/2020 21:55,1.25696E+18,verrenak,@satriaoo Bukalapak emg euy biang nya,Twitter for iPhone,0,0,bukalapak emg euy biang nya
5/3/2020 21:55,1.25696E+18,binsarwoko,"min @BukaBantuan @bukalapak , komplain dari 15 April belom ada kelanjutannya. Sudah follow up lewat telfon dan DM cuma disuruh tunggu sampe sekarang. Apa saya perlu tutup akun dan buat yang baru agar bisa berjualan? https://t.co/Ju2PqvQOjw",Twitter Web App,0,0,min komplain dari 15 april bom ada lanjut sudah follow up lewat telfon dan dm cuma suruh tunggu sampe sekarang apa saya perlu tutup akun dan buat yang baru agar bisa jual
5/3/2020 21:55,1.25696E+18,BukaBantuan,"@MSyaf7 Hai Kak. Kami informasikan, bahwa kami selalu meningkatkan sistem keamanan di Bukalapak, dan memastikan data-data penting pengguna tidak disalahgunakan. Untuk itu kami himbau kakak dapat memperhatikan keamanan saat bert.. https://t.co/8wfdnn4tak",Ivosights - Sociomile,0,0,hai kak kami informasi bahwa kami selalu tingkat sistem aman di bukalapak dan pasti datadata penting guna tidak disalahgunakan untuk itu kami himbau kakak dapat perhati aman saat bert
5/3/2020 21:54,1.25696E+18,fuzzzuf,"@sigitdwisav Eta buka asupkein email maneh, urg password bukalapak",Twitter for Android,0,0,eta buka asupkein email maneh urg password bukalapak
5/3/2020 21:53,1.25696E+18,BukaBantuan,@hillmyams Hai kak. Dengan senang hati akan Bella bantu ya kak. Setelah Bella cek kamu belum memasukkan resi pada sistem Bukalapak karena terdapat kendala memasukan resi ya kak. Namun setelah dilakukan pengecekan nomor resi yan.. https://t.co/CjuKBAWDVm,Ivosights - Sociomile,0,0,hai kak dengan senang hati akan bella bantu ya kak telah bella cek kamu belum masuk resi pada sistem bukalapak karena dapat kendala pasu resi ya kak namun telah laku kece nomor resi yan
5/3/2020 21:53,1.25696E+18,rayalghi,baru nyadar bukalapak ganti logo,Twitter for iPhone,0,0,baru nyadar bukalapak ganti logo
5/3/2020 21:53,1.25696E+18,kevinwibowo123,Semua bisa cek di https://t.co/koy4bOvrfX. Bukalapak ternyata lebih dulu menjual data pengguna sebelum Tokopedia https://t.co/kMNZTVGDSS https://t.co/1Jv30koHyY,Twitter Web App,4,0,semua bisa cek di bukalapak nyata lebih dulu jual data guna belum tokopedia
5/3/2020 21:53,1.25696E+18,ForHimMagazinee,@joyalrelly Fak aku kena di bukalapak,Twitter for iPhone,0,0,fak aku kena di bukalapak
5/3/2020 21:52,1.25696E+18,rinariris99,Besok senin ngajari anak anak SMA bikin usaha dari rumah manfaatkan teori motivasi dari channel youtube revolusi nekad demi bangkitnya ekonomi generasi Z  #Tokopedia #bukalapak  #PakeLinkAja  #orangkayagatau  https://t.co/Lwh2mVrCl6,Twitter for Android,0,0,besok senin ngajari anak anak sma bikin usaha dari rumah manfaat teori motivasi dari channel youtube revolusi nekad demi bangkit ekonomi generasi z
5/3/2020 21:52,1.25696E+18,chikitadelya,"@biskims @TokopediaCare Mas emang lagi bocor tokped sm bukalapak dari semalem, ganti pass deeeh",Twitter for Android,0,0,mas emang lagi bocor tokped sm bukalapak dari semalem ganti pass deeeh
5/3/2020 21:52,1.25696E+18,rememberinapril,@RstniScorpio https://t.co/w7LOLSx3r1,Twitter for Android,0,0,
5/3/2020 21:52,1.25696E+18,widhitinut,"@bandosenam @secgron Sama, bukalapak juga https://t.co/0EEn275V9f",Twitter for iPhone,0,0,sama bukalapak juga
5/3/2020 21:51,1.25696E+18,ddirrrr_,"@zulfiputraji Kereject, karna kan tiap transaksi ada sms otpnya juga kan.. paginya di tlp cs bank nya ngasih tau gue transaksi gak di bukalapak dengan nominal segitu.. gitu, jadi langsung blokir kartunya..",Twitter for iPhone,0,0,kereject karna kan tiap transaksi ada sms otpnya juga kan pagi di tlp cs bank nya ngasih tau gue transaksi gak di bukalapak dengan nominal segitu gitu jadi langsung blokir kartu
5/3/2020 21:51,1.25696E+18,Iftiashikado,"@iskandarwijaya @dhiazahirah @ronaldips Sama. Alhamdulillah tokpedku aman, Bukalapak malah kena 2 taun lalu pfft",Twitter Web App,0,0,sama alhamdulillah tokpedku aman bukalapak malah kena 2 taun lalu pfft
5/3/2020 21:51,1.25696E+18,theamels,@RioAnggaSaputra Aku kena yg bukalapak dong ÅEÅEÅE≠,Twitter for Android,0,0,aku kena yg bukalapak dong
5/3/2020 21:51,1.25696E+18,KayumasBike,"Pedal quick release MKS mkspedal Cygma Ezy, UB-Lite Ezy &amp; MT-E Ezy made in Japan ready ya gan di Kayumas Bike ÅEÅEÅEÄ  Harga dan barang-barang baru lainnya bisa dicek di Bukalapak, Tokopedia &amp; Shopee juga bisa kontak kamiÅEÄ¶ https://t.co/BDqnYawhjk",Instagram,1,0,pedal quick release mks mkspedal cygma ezy ublite ezy amp mte ezy made in japan ready ya gan di kayumas bike harga dan barangbarang baru lain bisa cek di bukalapak tokopedia amp shopee juga bisa kontak kami
5/3/2020 21:50,1.25696E+18,ojulz,@ceper7 @secgron Gue juga yang kena bukalapak,Twitter for iPhone,0,0,gue juga yang kena bukalapak
5/3/2020 21:50,1.25696E+18,ivanaliyf,@nyamnyamclvb Terus kalo udh gitu misalnya kan aku ada bukalapak sm canva tah trs gmn uit?,Twitter for Android,0,0,terus kalo udh gitu misal kan aku ada bukalapak sm canva tah trs gmn uit
5/3/2020 21:48,1.25696E+18,AnggaPutraF,"@mouldie_sep Iya kayak bukalapak, tanggal lahir dan alamat ini kan agak riskan ya.. udah dua ecommerce yang kena. Entah hackernya yang jago atau securitynya yang lemah..",Twitter for iPhone,0,0,iya kayak bukalapak tanggal lahir dan alamat ini kan agak riskan ya udah dua ecommerce yang kena entah hackernya yang jago atau securitynya yang lemah
5/3/2020 21:48,1.25696E+18,OLyaDebb,@NSMsidiq @rifqiabdie @secgron Bukalapak taun lalu bukan?,Twitter for Android,0,0,bukalapak taun lalu bukan
5/3/2020 21:48,1.25696E+18,andiniprbwt,"@BukaBantuan @duarkontil Min, bbrp bulan lalu kartu kredit ayah saya disalah gunakan orang buat belanja di buka lapak padahal gak pernah pakai kartu kredit buat belanja online huhuh lumayan gede jumlahnyaaa:'( udah ke bank, udah ke bukalapak gak ada jalan",Twitter for Android,1,0,min bbrp bulan lalu kartu kredit ayah saya salah guna orang buat belanja di buka lapak padahal gak pernah pakai kartu kredit buat belanja online huhuh lumayan gede jumlahnyaaa udah ke bank udah ke bukalapak gak ada jalan keluar buat bantu lacak akun
5/3/2020 21:48,1.25696E+18,tomatbusuk1,"@ismailfahmi Hadeh, passwordku leak justeru di Bukalapak tahun 2018",Twitter for Android,0,0,hadeh passwordku leak justeru di bukalapak tahun 2018
5/3/2020 21:47,1.25696E+18,Riyanii_17,Banyak banget jenis program pelatihan pra kerja di Bukalapak sampe bingung mau pelajarin yang mana dulu. @bukalapak levelnya udah beda sih aku suka banget ÅEÅE§ÅEÅE•∞ https://t.co/GXrNJfJtGw,Twitter for Android,1,0,banyak banget jenis program latih pra kerja di bukalapak sampe bingung mau pelajarin yang mana dulu level udah beda sih aku suka banget
5/3/2020 21:47,1.25696E+18,rinariris99,Besok senin yuuukk praktekkan nambah penghasilan dari rumah saja memanfaatkan otak kanan... Seru nich tips dari channel youtube revolusi nekad  #orangkayagatau  #bukalapak  https://t.co/Lwh2mVrCl6,Twitter for Android,1,0,besok senin yuuukk praktek nambah hasil dari rumah saja manfaat otak kanan seru nich tips dari channel youtube revolusi nekad
5/3/2020 21:46,1.25696E+18,BukaBantuan,"@neshaaiiaa Hai Kak. Kami informasikan, bahwa kami selalu meningkatkan sistem keamanan di Bukalapak, dan memastikan data-data penting pengguna tidak disalahgunakan. Untuk itu kami himbau kakak dapat memperhatikan keamanan saat .. https://t.co/9flWGWSHnK",Ivosights - Sociomile,0,0,hai kak kami informasi bahwa kami selalu tingkat sistem aman di bukalapak dan pasti datadata penting guna tidak disalahgunakan untuk itu kami himbau kakak dapat perhati aman saat
5/3/2020 21:46,1.25696E+18,mouldie_sep,"@AnggaPutraF Klo dilihat sih password encrypted. Jadi kasusnya sama kayak Bukalapak 2018. Data nomer hape, email, tanggal lahir keambil",Twitter for Android,5,0,klo lihat sih password encrypted jadi kasus sama kayak bukalapak 2018 data nomer hape email tanggal lahir ambil
5/3/2020 21:46,1.25696E+18,quigon_ndronkz,"@Daryant78508361 @bukalapak dah sy bantu potong a.n TWM. ditunggu potongan baliknya ya, makasih..",Twitter for Android,0,0,dah sy bantu potong an twm tunggu potong balik ya makasih
5/3/2020 21:45,1.25696E+18,CarelJeyfer27,"@Bahrizal_16 klo mau download apliksi bukalapak, jdi nanti akan ada notifnya buat klaim vouchernya. tp hoki2an gt. ini aj gue baru pertama kli dapet.",Twitter for iPhone,0,0,klo mau download apliksi bukalapak jdi nanti akan ada notifnya buat klaim vouchernya tp hoki2an gt ini aj gue baru pertama kli dapet
5/3/2020 21:45,1.25696E+18,BukaBantuan,"@Duwie73818012 Hai Kak. Kami informasikan, bahwa kami selalu meningkatkan sistem keamanan di Bukalapak, dan memastikan data-data penting pengguna tidak disalahgunakan. Untuk itu kami himbau kakak dapat memperhatikan keamanan sa.. https://t.co/yN0mzWGmRs",Ivosights - Sociomile,0,0,hai kak kami informasi bahwa kami selalu tingkat sistem aman di bukalapak dan pasti datadata penting guna tidak disalahgunakan untuk itu kami himbau kakak dapat perhati aman sa
5/3/2020 21:45,1.25696E+18,_krnlvn,I've tried and this is what I got... 6 out of 8 are my own email password ÅEÅE§°  1 bukalapak dan 1 lagi dubsmash(?) https://t.co/n6QzR28NXy,Twitter for Android,0,0,ive tried and this is what i got 6 out of 8 are my own email password 1 bukalapak dan 1 lagi dubsmash
5/3/2020 21:45,1.25696E+18,CarelJeyfer27,@krisnatsu bukalapak,Twitter for iPhone,0,0,bukalapak
5/3/2020 21:44,1.25696E+18,Alfi234,@itsmethomaass @ghali723 @secgron Saya ada di bukalapak.. Kira2 aman ga ya,Twitter for Android,0,0,saya ada di bukalapak kira2 aman ga ya
5/3/2020 21:44,1.25696E+18,DimasRedtux,"@secgron Gue coba ngecek pake email yang gak dipake akun apapun, masa kena juga. Dan tulisannya Bukalapak. Gue daftar Bukalapak aja gak pernah. Ah puyeng.",Twitter for Android,0,0,gue coba ngecek pake email yang gak dipake akun apa masa kena juga dan tulis bukalapak gue daftar bukalapak aja gak pernah ah puyeng
5/3/2020 21:43,1.25696E+18,erikaahy,mau jual temen di bukalapak laku gasih? temwn w gada otak semuaÅEÅEÅE≠,Twitter for iPhone,2,0,mau jual temen di bukalapak laku gasih temwn w gada otak semua
5/3/2020 21:43,1.25696E+18,rinariris99,Channel youtube revolusi nekad memberi solusi dengan kerja dari rumah saja....seru dan bermanfaat untuk nambah penghasilan #orangkayagatau #bukalapak  https://t.co/Lwh2mVrCl6,Twitter for Android,1,0,channel youtube revolusi nekad beri solusi dengan kerja dari rumah sajaseru dan manfaat untuk nambah hasil
5/3/2020 21:42,1.25696E+18,Athala_gallena,Aku juga ikutan optimis sama kartu pra kerja di Bukalapak. Banyak yang mau aku pelajarin buat nambah ilmu dan pengalaman. Suka banget sama @bukalapak ÅEÅEÅEÅEÅEÅE•∞ https://t.co/oLGO7Tolgz,Twitter for Android,0,0,aku juga ikut optimis sama kartu pra kerja di bukalapak banyak yang mau aku pelajarin buat nambah ilmu dan alam suka banget sama
5/3/2020 21:42,1.25696E+18,_loentuan,@teukufarhan @tokopedia @bukalapak @TokopediaCare Kamoe belanja bak keudei NyakDin jalan inong bale hana pake rekening prof,Twitter for Android,0,0,kamoe belanja bak ude nyakdin jalan inong bale hana pake rekening prof
5/3/2020 21:42,1.25696E+18,Chaconkk,Yahhh kena #bukalapak ÅEÅEÅE≠ https://t.co/2UU4XijRys,Twitter for Android,0,0,yahhh kena
5/3/2020 21:41,1.25696E+18,rinariris99,"Cara orang kaya memulai bisnis dari rumah saja dengan manfaatin tol langit pakdhe jokowi, begini tipsnya dari channel revolusi nekad... Kereen gaaeess #orangkayagatau #bukalapak  https://t.co/Lwh2mVrCl6",Twitter for Android,1,0,cara orang kaya mulai bisnis dari rumah saja dengan manfaatin tol langit pakdhe jokowi begini tipsnya dari channel revolusi nekad kereen gaaeess
5/3/2020 21:41,1.25696E+18,Ms_A____,Pada gembar gembor toped bocor Ini malah Bukalapak yg lupa pake pembalut.. Jebol  Tapi so far blm ada kejadian yg gimana2 sih.. https://t.co/VT0vGYnT2r,Twitter for Android,0,0,pada gembar gembor toped bocor ini malah bukalapak yg lupa pake balut jebol tapi so far blm ada jadi yg gimana2 sih
5/3/2020 21:40,1.25696E+18,bukalapak,"@praksarayoga Hi Kak, Kami informasikan, Bukalapak selalu meningkatkan sistem keamanan &amp; memastikan data-data pengguna tidak disalahgunakan. Kami imbau kakak dapat perhatikan keamanan saat bertransaksi dan mengikuti panduan yan.. https://t.co/lVRfu9i0",Ivosights - Sociomile,0,0,hi kak kami informasi bukalapak selalu tingkat sistem aman amp pasti datadata guna tidak disalahgunakan kami imbau kakak dapat perhati aman saat transaksi dan ikut pandu yan
5/3/2020 21:39,1.25696E+18,didihansya,@ichi_fm kalau bukalapak disini mba https://t.co/DduMelXfsc,Twitter for iPhone,0,0,kalau bukalapak sini mba
5/3/2020 21:39,1.25696E+18,anggiAPP,@satriaoo sama nih korban bukalapak -_- https://t.co/qPeghA9Ze7,Twitter for Android,0,0,sama nih korban bukalapak
5/3/2020 21:38,1.25696E+18,bukalapak,"@se0limit Apabila kakak, ingin melakukan penghapusan akun, mohon konfirmasi ke Bella email dan nomor telfon yang terdaftar di Bukalapak ya kak melalui inbox pastinya. ^AW",Ivosights - Sociomile,0,0,apabila kakak ingin laku hapus akun mohon konfirmasi ke bella email dan nomor telfon yang daftar di bukalapak ya kak lalu inbox pasti aw
5/3/2020 21:38,1.25696E+18,Mayvhia,"Barusan ngecek, dan voila.... Akun bukalapak punyaku pernah dimasuki https://t.co/cyZyHwQQn9",Twitter for Android,0,0,barusan ngecek dan voila akun bukalapak punya pernah masuk
5/3/2020 21:38,1.25696E+18,rinariris99,"Dengan dirumah saja maka kita bisa lebih produktif manfaatin tol langit untuk jualan online, channel revolusi nekad sarana untuk bangkit from home  #bukalapak https://t.co/IapBq2m1oi",Twitter for Android,0,0,dengan rumah saja maka kita bisa lebih produktif manfaatin tol langit untuk jual online channel revolusi nekad sarana untuk bangkit from home
5/3/2020 21:38,1.25696E+18,Duwie73818012,Iseng2 coba cek email di tokopedia ternyata akun @bukalapak yg dibajak ÅEÅEÅEÅEÅEÅEÅEÅE dan sudah setahun lalu... #bukalapak,Twitter for Android,1,0,iseng2 coba cek email di tokopedia nyata akun yg bajak dan sudah tahun lalu
5/3/2020 21:38,1.25696E+18,Dinda95_,Sempet ragu mau buka usaha jualan online tapi pas liat pelatihan pra kerja di Bukalapak jadi optimis buat buka usaha. Keren banget @bukalapak ÅEÅEÅEÅEÅEÅEÅEÅE https://t.co/3tmkr9BqDQ,Twitter for Android,0,0,sempet ragu mau buka usaha jual online tapi pas liat latih pra kerja di bukalapak jadi optimis buat buka usaha keren banget
5/3/2020 21:38,1.25696E+18,dejoblessman,"Gw punya dua email. Yang satu kena di bukalapak, yang satunya lg kena di canva. Ngeriww",Twitter for iPhone,0,0,gw punya dua email yang satu kena di bukalapak yang satu lg kena di canva ngeriww
5/3/2020 21:38,1.25696E+18,pppinkrebel,"@regatbudi Tadi gue cek bukalapak gue leaks nya udh 3yrs ago njir, tapi untungnya gue belom ngapa2in disana",Twitter Web App,0,0,tadi gue cek bukalapak gue leaks nya udh 3yrs ago njir tapi untung gue bom ngapa2in sana
5/3/2020 21:38,1.25696E+18,tsorayadina,Dah 2019 wkwkw :( mana bukalapak tu udh lupa pula,Twitter for Android,0,0,dah 2019 wkwkw mana bukalapak tu udh lupa pula
5/3/2020 21:37,1.25696E+18,Roviqul_Ahmad,"@fuaaaadss @secgron @bukalapak Sama, terus dh gini lanjutnya bgimna??",Twitter for Android,0,0,sama terus dh gin lanjut bgimna
5/3/2020 21:37,1.25696E+18,bukalapak,"@se0limit Hi Kak (Customer Name), Kami informasikan, Bukalapak selalu meningkatkan sistem keamanan &amp; memastikan data-data pengguna tidak disalahgunakan. Kami imbau kakak dapat perhatikan keamanan saat bertransaksi dan mengikuti.. https://t.co/EnvmxXtN",Ivosights - Sociomile,0,0,hi kak customer name kami informasi bukalapak selalu tingkat sistem aman amp pasti datadata guna tidak disalahgunakan kami imbau kakak dapat perhati aman saat transaksi dan ikut
5/3/2020 21:37,1.25696E+18,irmassofyan,@vickyroyibha aku juga nih tapi alhamdulillah cuma satu di bukalapak wkwk,Twitter for iPhone,0,0,aku juga nih tapi alhamdulillah cuma satu di bukalapak wkwk
5/3/2020 21:37,1.25696E+18,triyaanggasukma,ÅEÅEÅE™ÅEÅEÅEÅEÅEÅEÅEÅEÅEÅEÅEÅE ÅEÅEÅE•ÅEÅEÅEÅEÅEÅEÅEßÅEÅEÅE£ÅEÅEÅEÅEÅEÅEÅEÅE ÅEÅEÅE°ÅEÅEÅEÅEÅEÅEÅEÅEÅEÅEÅE© ÅEÅEÅEÅEÅEÅEÅEÅEÅEÅEÅEÅEÅEÅEÅEÅEÅEÅEÅEÅEÅEÅEÅEÅEÅEÅEÅEßÅEÅEÅEÅE ÅEÅEÅE†ÅEÅEÅEÅEÅEÅEÅE©ÅEÅEÅEÅEÅEÅEÅE¨ÅEÅEÅEÅE ÅEÅEÅEÅEÅEÅEÅEÅEÅEÅEÅE† ÅEÅEÅE ÅEÅEÅEÅEÅEÅEÅEÅEÅEÅEÅEÅE ÅEÅEÅE¨ÅEÅEÅEÅE ÅEÅEÅE†ÅEÅEÅEÅEÅEÅEÅE®ÅEÅEÅEÅEÅEÅEÅEÅE ÅEÅEÅE©ÅEÅEÅEÅEÅEÅEÅE™. Feby Nana anak SMA #LulusJalurCorona  mau online shop Bukalapak #Tokopedia https://t.co/AwYrNQEgve,Twitter for Android,104,29,feby nana anak sma mau online shop bukalapak
5/3/2020 21:37,1.25696E+18,yeolsenpai,ya allah untung selama ini akun tokped bukalapak dkk gua sangkutin ke email bodong yang isinya spam ama sampah doang....,Twitter for Android,0,0,ya allah untung lama ini akun tokped bukalapak dkk gua sangkutin ke email bodong yang isi spam ama sampah doang
5/3/2020 21:36,1.25696E+18,wahisme,"@NOTASLIMBOY haha gak mau ngaku kalo puluhan jt nama, alamat, dob, no. hp &amp; email users udah kesebar ÅEÅEÅEÅE  tokped bisa dituntut? https://t.co/DOIn38vnkp",Twitter for Android,0,0,haha gak mau ngaku kalo puluh jt nama alamat dob no hp amp email users udah sebar tokped bisa tuntut
5/3/2020 21:36,1.25696E+18,regatbudi,"Yang gua takutkan di masa depan: Berkat kejahatan digital, orang-orang udah ga punya lagi privasi. Ini yang bikin gua ga percaya buat naro bio lengkap di platform semacam BL, J*nius, Bib*t dsb. Lo mau percaya? Silahkan, mind your own bussiness.. https://t.co/VsbW7APRuY",Twitter for Android,0,0,yang gua takut di masa depan berkat jahat digital orangorang udah ga punya lagi privasi ini yang bikin gua ga percaya buat naro bio lengkap di platform macam bl jnius bibt dsb lo mau percaya silah mind your own bussiness
