tweet_time,tweet_id,username,tweet_text,source,favourite,retweet,clean
5/3/2020 19:01,1.25692E+18,aprilaladin,"@Zadakidi Don't connect your Dana payment to bukalapak, there's no need pin to entered when someone hack your account and make a transaction",Twitter Web App,0,0,dont connect your dana payment to bukalapak theres no need pin to entered when someone hack your account and make a transaction
5/3/2020 19:01,1.25692E+18,li_rifqi,"toped gw aman malah bukalapak, dan akun2 game yg jarang di maenin yg kena hack -_- gabut ametsi hacker2 nii #Tokopedia https://t.co/EGSj3EmYAv",Twitter Web App,3,0,toped gw aman malah bukalapak dan akun2 game yg jarang di maenin yg kena hack gabut ametsi hacker2 nii
5/3/2020 19:01,1.25692E+18,rahsabi,Sekarang giliran Bukalapak.,Twitter Web App,0,0,sekarang gilir bukalapak
5/3/2020 19:01,1.25692E+18,mshasannn,"Mutualku plis bantu rtweet, biar tetep bisa makn smpai lbaran ÅEÅEÅEÅEÅEÅEÅEÅEÅEÅEÅEÅE  Ready Stock Kaos Manusia Merdeka Warna Biru Dongker - Hitam - Merah Bahan Cotton Combed - Sablon Plastisol  IDR 70.000 Pengiriman Kediri  https://t.co/XYjdwBBq7E 082257562211  #bukalapak  #tokopedia #seventeen https://t.co/ksv3zZMZPY",Twitter for Android,1,2,mutualku plis bantu rtweet biar tetep bisa makn smpai lbaran ready stock kaos manusia merdeka warna biru dongker hitam merah bahan cotton combed sablon plastisol idr 70000 kirim diri 082257562211
5/3/2020 19:00,1.25692E+18,Rahardipoetra,Ngecek di dua situs yg berbeda kena dong #bukalapak https://t.co/9fkRCxELNV,Twitter for Android,1,1,ngecek di dua situs yg beda kena dong
5/3/2020 19:00,1.25692E+18,Ilhamou8,Dikira saya kena di tokopedia taunya di Bukalapak https://t.co/ewpiT6MicC,Twitter for Android,0,0,kira saya kena di tokopedia tau di bukalapak
5/3/2020 19:00,1.25692E+18,vikkinurastarii,Ngecek tokopedia malah bukalapak yang kebobolan sudah setahun pula https://t.co/S3oPfOzr2e,Twitter for iPhone,0,0,ngecek tokopedia malah bukalapak yang bobol sudah tahun pula
5/3/2020 19:00,1.25692E+18,mhmdsibro,berkaca dari yang dulu mengenai kebocoran data bukalapak. https://t.co/jsEsMmHsaZ  mari kita belajar dari sejarah dan mulai menghilangkan kebiasaan kagetan dan panik serta abai dalam hal sepele seperti data pribadi.,Twitter Web App,2,1,kaca dari yang dulu kena bocor data bukalapak mari kita ajar dari sejarah dan mulai hilang biasa kaget dan panik serta abai dalam hal sepele seperti data pribadi
5/3/2020 19:00,1.25692E+18,mhmdsibro,Sebuah Utas Cara Ngamanin Akun Pribadi : - #Tokopedia / tokped  - Bukalapak - Sosial media lainnya,Twitter Web App,450,188,buah utas cara ngamanin akun pribadi tokped bukalapak sosial media lain
5/3/2020 19:00,1.25692E+18,bukalapak,"APAAAA? Shampoo sama hand cleanser gel cuma goceng aja? Sikaaat gengggs!!!!  Gak bisa dibiarin berlalu gitu aja sih promonya. Ayo kabarin mama papa, adek kakak, biar sama-sama borong di https://t.co/lyMaHMXh3z https://t.co/aQtXPJaDgb",TweetDeck,6,0,apaaaa shampoo sama hand cleanser gel cuma goceng aja sikaaat gengggs gak bisa dibiarin lalu gitu aja sih promonya ayo kabarin mama papa adek kakak biar samasama borong di
5/3/2020 18:59,1.25692E+18,arifwcksna,wih alhamdulillah ga kena padahal gunain tokped sama bukalapak juga https://t.co/Fy6zHN2Arb,Twitter for iPhone,0,0,wih alhamdulillah ga kena padahal gunain tokped sama bukalapak juga
5/3/2020 18:59,1.25692E+18,Akspetbonenife,"Udh cek beberapa website yang menyediakan cek keamanan pembobolan akun email bst, cuma ada 1 itu canva, #tokopedia #bukalapak nihil, mungkin sering lupa sandi, w ganti sandi buat login, efek yang bagus juga nih, semoga aplikasi bst bisa memperbaiki ke amanan nya.",Twitter for Android,0,0,udh cek beberapa website yang sedia cek aman bobol akun email bst cuma ada 1 itu canva nihil mungkin sering lupa sandi w ganti sandi buat login efek yang bagus juga nih moga aplikasi bst bisa baik ke aman nya
5/3/2020 18:59,1.25692E+18,iufilters,Bukalapak https://t.co/6ihbgtOIB5,Twitter for Android,0,0,bukalapak
5/3/2020 18:58,1.25692E+18,Mlnftri,@N_AraJKT48 Dah isya met bukalapak,Twitter for iPhone,0,0,dah isya met bukalapak
5/3/2020 18:58,1.25692E+18,mstvus,Wah anjir akun bukalapak sama tokped gua kena. Data2 aing dijual bebas wkwkwk https://t.co/Y6TIfCaVOf,Twitter for Android,0,0,wah anjir akun bukalapak sama tokped gua kena data2 aing jual bebas wkwkwk
5/3/2020 18:57,1.25692E+18,chikiseribuann,wkwkwk bukalapak kena juga..,Twitter Web App,0,0,wkwkwk bukalapak kena juga
5/3/2020 18:57,1.25692E+18,BukaBantuan,"@krupukalengan Baik kak. Apabila kakak masih memiliki kendala/pertanyaan seputar Bukalapak, silakan hubungi Bella kembali ya. Selamat beraktivitas kembali dan selalu jaga kesehatan ya kak ÅEÅE•∞ ^-",Ivosights - Sociomile,0,0,baik kak apabila kakak masih milik kendalapertanyaan putar bukalapak sila hubung bella kembali ya selamat aktivitas kembali dan selalu jaga sehat ya kak
5/3/2020 18:57,1.25692E+18,iqbalimovici,@bukalapak cek dm min,Twitter for Android,0,0,cek dm min
5/3/2020 18:57,1.25692E+18,imcuteeee_,"Liat trending autocek Dan ternyata email w kena bobol jga :') Tokopedia, Canva, Bukalapak https://t.co/TLBl4f9052",Twitter for Android,1,0,liat trending autocek dan nyata email w kena bobol jga tokopedia canva bukalapak
5/3/2020 18:56,1.25692E+18,Rosyidakyo_,Bukn cuma bukalapak sama tokopedia.. ternyata dubsmash juga .. astaga ini apk sudah lama sekali dahal :( https://t.co/szDZw4D2NK,Twitter for Android,1,0,bukn cuma bukalapak sama tokopedia nyata dubsmash juga astaga ini apk sudah lama sekali dahal
5/3/2020 18:56,1.25692E+18,eDzulfikar,@Mubaroqq @bukalapak Ni indikasi emang bobol massal,Twitter for Android,0,0,ni indikasi emang bobol massal
5/3/2020 18:56,1.25692E+18,eDzulfikar,@rrptnrr Yg bukalapak,Twitter for Android,0,0,yg bukalapak
5/3/2020 18:55,1.25692E+18,alkazzzzz,@aewin86 Gua juga kena di @bukalapak sama @canva ÅEÅEÅEÅEÅEÅEÅEÅEÅEÅEÅEÅE,Twitter for Android,0,0,gua juga kena di sama
5/3/2020 18:55,1.25692E+18,BukaBantuan,"@nephillaa Hallo kakak, ada kendala terkait dengan akun Bukalapak atau transaksi kakak ? Bella bantu infokan untuk perihal keamanan, Bukalapak akan tetap senantiasa selalu menjaga kerahasiaan penggunanya. Pastikan kakak selalu .. https://t.co/FwzSTX8IEE",Ivosights - Sociomile,2,1,hallo kakak ada kendala kait dengan akun bukalapak atau transaksi kakak bella bantu info untuk perihal aman bukalapak akan tetap senantiasa selalu jaga rahasia guna pasti kakak selalu
5/3/2020 18:55,1.25692E+18,XReyAhmad,@treyaieden yay ternyata di bukalapak ÅEÅE§¶ÅEÅEÅEø https://t.co/YmapJCe5fq,Twitter for Android,0,0,yay nyata di bukalapak
5/3/2020 18:55,1.25692E+18,Danjunisme,"@zisaer_ @secgron Sm gw juga, bukalapak sm canva",Twitter for Android,1,0,sm gw juga bukalapak sm canva
5/3/2020 18:55,1.25692E+18,Mubaroqq,"@eDzulfikar @bukalapak Weh, iya punyaku juga tanggal segitu",Twitter for Android,0,0,weh iya punya juga tanggal segitu
5/3/2020 18:55,1.25692E+18,aripmust,"Lagi trending kebocoran data akun Tokopedia &amp; Bukalapak. Nasib yg sama bisa terjadi pd lbh dr 8,6 jt calon peserta kartu prakerja krn daftar pelatihan online via 8 platform digital. Waspadalah! #TolakKomersialisasiKartuPrakerja",Twitter for iPhone,2,3,lagi trending bocor data akun tokopedia amp bukalapak nasib yg sama bisa jadi pd lbh dr 86 jt calon serta kartu prakerja krn daftar latih online via 8 platform digital waspada
5/3/2020 18:54,1.25692E+18,dhera116,"@sdzarroh22 @taufik_zaid @Mokhamadsolikin @mohammadsolik10  cek akun tokopedia, bukalapak di https://t.co/N3WwvDxyED masukin email",Twitter Web App,0,0,cek akun tokopedia bukalapak di masukin email
5/3/2020 18:54,1.25692E+18,krupukalengan,@BukaBantuan Saya sudah hapus app @bukalapak,Twitter for Android,0,0,saya sudah hapus app
5/3/2020 18:54,1.25691E+18,syahrilputh_,@eDzulfikar @cokelatbutir @bukalapak Saya maret https://t.co/9pgLog2g9s,Twitter for Android,0,0,saya maret
5/3/2020 18:54,1.25691E+18,itadakimasjun,"Ngomong-ngomong soal tokped yg datanya ke-leak, tadi iseng2 nyoba ini. Seingetku aku ga pernah bikin akun bukalapak?? https://t.co/DHvt7n9KDY",Twitter for Android,0,0,ngomongngomong soal tokped yg data leak tadi iseng2 nyoba ini seingetku aku ga pernah bikin akun bukalapak
5/3/2020 18:54,1.25691E+18,cuitankholis,"Selain Tokopedia @TokopediaCare, ternyata Bukalapak @BukaBantuan juga. https://t.co/k2xXCIwglG",Twitter for Android,0,1,selain tokopedia nyata bukalapak juga
5/3/2020 18:53,1.25691E+18,Mas_Zaiii,"Yg pake kartu internetannya @byu_id yuk temenan,  drpd gratis telfonannya gak kepake kan mubadzirÅEÅEÅEÅE  Bukalapak Tokopedia  Shopee #LulusJalurCorona https://t.co/RoO3i98lQX",Twitter for Android,1,0,yg pake kartu internetannya yuk temenan drpd gratis telfonannya gak kepake kan mubadzir bukalapak tokopedia shopee
5/3/2020 18:53,1.25691E+18,olgacintapeyek,@Hayoloo__ @shiyerenn Bukalapak?,Twitter for Android,0,0,bukalapak
5/3/2020 18:53,1.25691E+18,summerdepressio,"my bukalapak, canva, and tokopedia acc have been breachedÅEÅEÅEÅE fuuuudgeÅEÅEÅEÅE",Twitter for Android,1,0,my bukalapak canva and tokopedia acc have been breached fuuuudge
5/3/2020 18:53,1.25691E+18,sayryjer,"Shit, data Bukalapak gue ternyata bocor.",Twitter for Android,0,1,shit data bukalapak gue nyata bocor
5/3/2020 18:52,1.25691E+18,GinanjarAhsa,"@rizkartv Reviewnya setelah pada cek pake web itu ternyata bukan cuma tokped tapi bukalapak dll juga kebobol, ada yang ngeakses",Twitter for iPhone,0,0,reviewnya telah pada cek pake web itu nyata bukan cuma tokped tapi bukalapak dll juga bobol ada yang ngeakses
5/3/2020 18:52,1.25691E+18,fadlinyamana,Nyari Tomica JAF di tokped lebih banyak daripada shoppe ato bukalapak ÅEÅEÅEÅEÅEÅEÅE∂,Twitter for Android,0,0,nyari tomica jaf di tokped lebih banyak daripada shoppe ato bukalapak
5/3/2020 18:52,1.25691E+18,Aryoprb,@kuahrendangenak @tyasandala1 Bukalapak gw kebobolan dong njir https://t.co/0dEyQLmYVN,Twitter for Android,0,1,bukalapak gw bobol dong njir
5/3/2020 18:51,1.25691E+18,AldiDista,Seng lagi rame . Niat chek akun tokopedia malah . Hm #bukalapak #tokopedia https://t.co/fjY7crPvy3,Twitter for Android,3,1,seng lagi rame niat chek akun tokopedia malah hm
5/3/2020 18:51,1.25691E+18,elninovena,"Setelah ada indikasi pembobolan tokopedia aku cek email ternyata dubsmash yang pernah dibobol, lah kapan main dubsmash , buatnya aja lupa  #Tokopedia #bukalapak #dubsmash https://t.co/5lvxsOg6NN",Twitter for Android,17,4,telah ada indikasi bobol tokopedia aku cek email nyata dubsmash yang pernah bobol lah kapan main dubsmash buat aja lupa
5/3/2020 18:51,1.25691E+18,ignatiusbanu,Bukalapak juga pernah jadi primadona gegara bisa nego dan barang yg relatif lebih murah daripada lapak lainnya . tapi sayang ada perubahan aturan tentang cashback yg awalnya kadaluarsa 180 hari menjadi 7 hari saja . ya mau gak mau otomatis cabut .,Twitter for Android,0,0,bukalapak juga pernah jadi primadona gegara bisa nego dan barang yg relatif lebih murah daripada lapak lain tapi sayang ada ubah atur tentang cashback yg awal kadaluarsa 180 hari jadi 7 hari saja ya mau gak mau otomatis cabut
5/3/2020 18:51,1.25691E+18,krupukalengan,Parah @bukalapak @BukaBantuan ÅEÅEÅEÅEÅEÅEÅE≥ÅEÅEÅEµÅEÅEÅE± https://t.co/2Wa0KiyrKR,Twitter for Android,0,0,parah
5/3/2020 18:51,1.25691E+18,cepdamang,#bukalapak buat yang jomblo sini merapat mhehe https://t.co/AbqsXNVVhd,Twitter for Android,3,1,buat yang jomblo sini rapat mhehe
5/3/2020 18:50,1.25691E+18,eDzulfikar,Tolong woy apa benar @bukalapak kebobolan data tanggal 18 april 2019 secara massal?   Gw liat di temlen rata2 tanggal segitu kebobolannya? https://t.co/iMFQya2ZZS,Twitter for Android,1,0,tolong woy apa benar bobol data tanggal 18 april 2019 cara massal gw liat di temlen rata2 tanggal segitu bobol
5/3/2020 18:49,1.25691E+18,cokelatbutir,"@eDzulfikar @bukalapak lah iya yaa, banyak yg sama harinya",Twitter for Android,0,0,lah iya yaa banyak yg sama hari
5/3/2020 18:48,1.25691E+18,telegendut,Saldo gue di #tokopedia 170 rupiah. Kalaupun diembat hacker gue ikhlas ÅEÅE§£  Bukalapak udah setahun uninstall. Bukan gegara caca handika jd bintang iklannya ÅEÅEÅEÅE. Cuma emang gak pernah make,Twitter for Android,0,0,saldo gue di 170 rupiah kalaupun embat hacker gue ikhlas bukalapak udah tahun uninstall bukan gegara caca handika jd bintang iklan cuma emang gak pernah make
5/3/2020 18:48,1.25691E+18,wilmAn_A,"@kopisenjahari @XJAPAN_ID Mau gw jual nih di bukalapak, udah gak muat ÅEÅEÅEÅE https://t.co/CGC005yjCN",Twitter for iPhone,0,0,mau gw jual nih di bukalapak udah gak muat
5/3/2020 18:48,1.25691E+18,athpsp,Akun bukalapak gua kena retas https://t.co/LHtBAZHCPV,Twitter for Android,0,1,akun bukalapak gua kena retas
5/3/2020 18:48,1.25691E+18,Muhamma01749761,@bukalapak,Twitter for Android,0,0,
5/3/2020 18:48,1.25691E+18,austin_dika,"Aku selalu . . . Dimatamu, besok aku pindah ke hidungmuÅEÅEÅEÅE  #Tokopedia  #bukalapak https://t.co/UshqRlC7we",Twitter for Android,0,1,aku selalu mata besok aku pindah ke hidung
5/3/2020 18:48,1.25691E+18,alfianimufd,"ngecek email di avast, eh akun bukalapak gue sedang tidak aman, wkk. *auto buka aplikasinya, pas mau ngedit profil ganti email, eh ternyata email bukalapak gue bukan yg email itu dong ÅEÅEÅEÅE",Twitter for Android,0,0,ngecek email di avast eh akun bukalapak gue sedang tidak aman wkk auto buka aplikasi pas mau ngedit profil ganti email eh nyata email bukalapak gue bukan yg email itu dong
5/3/2020 18:48,1.25691E+18,nephillaa,@bukalapak Gua unistal BL karena tidak aman.,Twitter for Android,0,0,gua unistal bl karena tidak aman
5/3/2020 18:47,1.25691E+18,eDzulfikar,@cokelatbutir Gw juga kok di hari yg sama ya? Ni bobol massal apa gimana? Cc @bukalapak https://t.co/bD2jTghtBf,Twitter for Android,1,1,gw juga kok di hari yg sama ya ni bobol massal apa gimana cc
5/3/2020 18:47,1.25691E+18,amiiKonic,Mau ngecek kebocoran data dari tokopedia ternyata yang bocor dari: - bukalapak - ipusnas - youthmanual - yahoo - canva Dan itu semua ternyata udah dari lama terjual di dark web. Apalagi bukalapak. https://t.co/ExBXq0rlYG,Twitter for Android,3,2,mau ngecek bocor data dari tokopedia nyata yang bocor dari bukalapak ipusnas youthmanual yahoo canva dan itu semua nyata udah dari lama jual di dark web apalagi bukalapak
5/3/2020 18:47,1.25691E+18,manakutau_mas,"Rata2 yg kena bukalapak, canva ya wkwk yg tokped malah gk ada, syukurlah.. https://t.co/9443CXqWZr",Twitter for Android,0,1,rata2 yg kena bukalapak canva ya wkwk yg tokped malah gk ada syukur
5/3/2020 18:47,1.25691E+18,Dimas_H_Saputra,@secgron Wah cok pindah bukalapak cok gih @ardo1301,Twitter for Android,0,0,wah cok pindah bukalapak cok gih
5/3/2020 18:47,1.25691E+18,rrptnrr,dan trnyata akun bukalapak dan canva serta 3 akun lainnya pernah d retas ÅEÅE§ÅE,Twitter Web App,0,0,dan trnyata akun bukalapak dan canva serta 3 akun lain pernah d retas
5/3/2020 18:47,1.25691E+18,circleofisnia,Bukalapak saya jg sudah kena ternyata ÅEÅEÅE¢ https://t.co/2wG8KrRp4Q,Twitter for Android,0,0,bukalapak saya jg sudah kena nyata
5/3/2020 18:47,1.25691E+18,agungprats,akun bukalapak sama canva gw ternyata udah ke breached https://t.co/wChiHhv2ws,Twitter for Android,0,0,akun bukalapak sama canva gw nyata udah ke breached
5/3/2020 18:46,1.25691E+18,dwiharyadi_st,KINOKI GOLD DETOX FOOT PADS ORIGINAL ... https://t.co/uyM5VngeMq,Bukalapak,0,0,kok gold detox foot pads original
5/3/2020 18:46,1.25691E+18,adhikatdp,"Tokopedia yg kena hack, bukalapak kebawa bawaÅEÅEÅEÅE",Twitter for iPhone,0,0,tokopedia yg kena hack bukalapak bawa bawa
5/3/2020 18:45,1.25691E+18,icamarica,"@imbilizer Iya lho. Gw juga. Gw pernah coba semua Lazada, shopee, blibli, jdid, bukalapak, bhinneka...tetep aja balik lagi ke toped. It eats my money.",Twitter for Android,0,0,iya lho gw juga gw pernah coba semua lazada shopee blibli jdid bukalapak bhinnekatetep aja balik lagi ke toped it eats my money
5/3/2020 18:44,1.25691E+18,BukaBantuan,"@Sarippu20934684 Hai kak, maaf banget nih sebelumnya. Karena keterbatasan info dari Bella. Untuk hal tersebut mohon sedianya menunggu info atau update terbaru dari Bukalapak dan pastinya tim kami selalu melakukan pengecekan ter.. https://t.co/st3LDNkxux",Ivosights - Sociomile,0,0,hai kak maaf banget nih belum karena batas info dari bella untuk hal sebut mohon sedia tunggu info atau update baru dari bukalapak dan pasti tim kami selalu laku kece ter
5/3/2020 18:43,1.25691E+18,CiledugOnline,Belanja yg paling aman adalah dgn cara tradisional yaitu tatap muka antara pembeli dan penjual.   Sekarang kasus kan tuh yg belanja online di aplikasi pada di colongin datanya.   Kasihan nasib jadi pelanggan Tokopedia sama Bukalapak,Twitter for Android,1,0,belanja yg paling aman adalah dgn cara tradisional yaitu tatap muka antara beli dan jual sekarang kasus kan tuh yg belanja online di aplikasi pada di colongin data kasihan nasib jadi langgan tokopedia sama bukalapak
5/3/2020 18:42,1.25691E+18,khafidmdr,"Njir malah akun bukalapak yang kena, nyesel asw pake bukalapak gak aman parah, udha 1 tahun yg lalu tp baru tau",Twitter for Android,0,0,njir malah akun bukalapak yang kena nyesel asw pake bukalapak gak aman parah udha 1 tahun yg lalu tp baru tau
5/3/2020 18:42,1.25691E+18,zxxynia,Ga kena di #Tokopedia atau #Bukalapak tapi kena di Canva dong. Bangekkk,Twitter Web App,0,1,ga kena di atau tapi kena di canva dong bangekkk
5/3/2020 18:42,1.25691E+18,fadilahafif,Syitttt ternyata ga hoax bukalapak.... https://t.co/ZsdHqOHfMT https://t.co/BOXag9R749,Twitter for iPhone,0,0,syitttt nyata ga hoax bukalapak
5/3/2020 18:42,1.25691E+18,leehaera1996,Om @eldidito ini kalau email ke leaked (tokped&amp;bukalapak) gimana nih?,Twitter for Android,0,0,om ini kalau email ke leaked tokpedampbukalapak gimana nih
5/3/2020 18:42,1.25691E+18,merahganda,"@alfiasarii Hati hati ya sari, bukalapak mu itu",Twitter for Android,0,0,hati hati ya sari bukalapak mu itu
5/3/2020 18:42,1.25691E+18,ferofh,Iseng¬≤ cek yakan apakah akun Tokopedia gua termasuk yg dibobol datanya... Eh gataunya malah yg keluar bukalapak anjir https://t.co/IdoPFU5FK4,Twitter for Android,1,1,iseng cek yakan apakah akun tokopedia gua masuk yg bobol data eh gataunya malah yg keluar bukalapak anjir
5/3/2020 18:42,1.25691E+18,iqianu,Buat yang biasa bikin password sama di semua sosmednya pasti panik denger Kabar Data pengguna Bukalapak dan #Tokopedia  dibobol.,Twitter for Android,12,0,buat yang biasa bikin password sama di semua sosmednya pasti panik denger kabar data guna bukalapak dan bobol
5/3/2020 18:41,1.25691E+18,jaehyunpft,Sekarang mereka tersedia di bukalapak wkk https://t.co/52AftA4ijj,Twitter for Android,0,1,sekarang mereka sedia di bukalapak wkk
5/3/2020 18:41,1.25691E+18,shimaszaky,WTF @bukalapak @tokopedia !! Really pissed me off https://t.co/PHPlh7wDhf,Twitter Web App,9,2,wtf really pissed me off
5/3/2020 18:41,1.25691E+18,KarlenJannatin,"Lapar lapar pas wabah, hmm enaknya ngehack Tokopedia &amp; Bukalapak. Lumayan bisa kenyang",Twitter Web App,0,0,lapar lapar pas wabah hmm enak ngehack tokopedia amp bukalapak lumayan bisa kenyang
5/3/2020 18:41,1.25691E+18,muhreynaldi,Kemarin2 tokopedia sekarang bukalapak hadeuh,Twitter for iPhone,0,0,kemarin2 tokopedia sekarang bukalapak hadeuh
5/3/2020 18:41,1.25691E+18,piaraanlepas,"@Muhaziz_Hatta @underthebreach @tokopedia Bukalapak barang ternyata, man.",Twitter for Android,0,0,bukalapak barang nyata man
5/3/2020 18:41,1.25691E+18,DwiPrasetyaSan1,#Tokopedia aman.. #bukalapak udah tahun kemaren.. https://t.co/Fd4vMC4Fwi,Twitter for Android,0,1,aman udah tahun kemaren
5/3/2020 18:41,1.25691E+18,_miemie2,@AbdWarisAnwar1 Untuk ga pakai Bukalapak ÅEÅEÅEÅE,Twitter for Android,1,0,untuk ga pakai bukalapak
5/3/2020 18:40,1.25691E+18,andri_desmana,"Yang punya itu disebut nya founder mba Founder juga bisa merangkap sebagai ceo, contoh nya mas zaky di bukalapak terdahulu. https://t.co/nzt8mBfxXI",Twitter for iPhone,0,0,yang punya itu sebut nya founder mba founder juga bisa rangkap bagai ceo contoh nya mas zaky di bukalapak dahulu
5/3/2020 18:40,1.25691E+18,katak_tersedak,@lvcvih @bukalapak gercep masnya,Twitter for Android,0,0,gercep mas
5/3/2020 18:40,1.25691E+18,M_Jahroni,"Trending Bukalapak dan Tokopedia kebanyakan bahasa inggris , gak tau akun2 asli atau bukan tapi rata2 sama isi nya  Hmm..",Twitter for Android,0,0,trending bukalapak dan tokopedia banyak bahasa inggris gak tau akun2 asli atau bukan tapi rata2 sama isi nya hmm
5/3/2020 18:40,1.25691E+18,echaresaAR3,Ternyata bukalapak juga jual jual video ÅEÅE§≠ÅEÅE§≠ÅEÅE§≠ Kursus kartu prakerja terlengkap &amp; termurah ÅEÅEÅEÅE https://t.co/uJAOpwKCue,Twitter for Android,0,0,nyata bukalapak juga jual jual video kursus kartu prakerja lengkap amp murah
5/3/2020 18:39,1.25691E+18,tukangkebunkata,bukapalak bukalapak bukapak kapak pak pak pak,Twitter Web App,0,0,bukapalak bukalapak bukapak kapak pak pak pak
5/3/2020 18:38,1.25691E+18,Sukabosen_uye,"Astaga kaget udah 4 yg bocor, dan Bukalapak udah 1 tahun yg lalu gilss https://t.co/JvVYwpYimC",Twitter for Android,3,1,astaga kaget udah 4 yg bocor dan bukalapak udah 1 tahun yg lalu gilss
5/3/2020 18:38,1.25691E+18,mataiikan,Bukalapak aja dot com,Twitter for Android,0,0,bukalapak aja dot com
5/3/2020 18:37,1.25691E+18,ARTTAEC,"@Lioness_58 gak kena sih cuma ngeri aja katanya udh 91jt.. dan tokped penggunanya emang 90jtan.. td w cek yg avasst2 itu yg kena malah gmail, bli2 ama bukalapakÅEÅEÅEÅE gmailnya dah w ganti pw",Twitter for Android,0,0,gak kena sih cuma ngeri aja kata udh 91jt dan tokped guna emang 90jtan td w cek yg avasst2 itu yg kena malah gmail bli2 ama bukalapak gmailnya dah w ganti pw
5/3/2020 18:37,1.25691E+18,niawul1,@cokelatbutir aku juga akun bukalapak bocor dari 2017 :((,Twitter for iPhone,0,0,aku juga akun bukalapak bocor dari 2017
5/3/2020 18:37,1.25691E+18,yaumilchai,@alvindelahoya Akun bukalapak sama dubsmash ÅEÅE§™ Bahaya gak klw gak kuganti? Toh aku gak pake aplikasi2 itu lagi,Twitter Web App,0,0,akun bukalapak sama dubsmash bahaya gak klw gak ganti toh aku gak pake aplikasi2 itu lagi
5/3/2020 18:37,1.25691E+18,fhy98,"Haechan sungjae jaehyun shindong bukalapak ÅEÅE§£ ngakak, kapan blackpink comeback sih ÅEÅEÅEÅE",Twitter for Android,1,0,haechan sungjae jaehyun shindong bukalapak ngakak kapan blackpink comeback sih
5/3/2020 18:36,1.25691E+18,maksi4888,@Haluan_media barusan ngecek eeeeh akun #bukalapak yg kena  dah lama gak aktif di bl. https://t.co/4xDEkz7Dmg,Twitter for Android,1,1,barusan ngecek eeeeh akun yg kena dah lama gak aktif di bl
5/3/2020 18:36,1.25691E+18,SierraLilimee,"@cokelatbutir Sama mba aku juga bukalapak, tokped, sm canva. Trus canva dah ganti pass kok tetep ada ya",Twitter for Android,3,0,sama mba aku juga bukalapak tokped sm canva trus canva dah ganti pass kok tetep ada ya
5/3/2020 18:36,1.25691E+18,win_cahyadi,"Ceritanya mau coba ikut promo dari bukalapak ini, sesudah share ke temen dan mereka klik tetep gak ada perubahan. Apakah ini termasuk promo pak kibul? https://t.co/jmSH8STZnX",Twitter Web App,2,1,cerita mau coba ikut promo dari bukalapak ini sudah share ke temen dan mereka klik tetep gak ada ubah apakah ini masuk promo pak kibul
5/3/2020 18:36,1.25691E+18,wisangsp,@secgron Yahhh kok bukalapak juga https://t.co/llDYZ81OMT,Twitter for iPhone,1,0,yahhh kok bukalapak juga
5/3/2020 18:36,1.25691E+18,raynaldiharwan,Bukalapak juga masalah? Wew,Twitter for Android,1,0,bukalapak juga masalah wew
5/3/2020 18:36,1.25691E+18,satanicnebula,"@kifkifu Njiir gue pernah ada request code ke whatsapp dari bukalapak sampe berkali2 anjir. Itu serem bgt, terbongkarlah sudah...",Twitter Web App,1,0,njiir gue pernah ada request code ke whatsapp dari bukalapak sampe berkali2 anjir itu rem bgt bongkar sudah
5/3/2020 18:35,1.25691E+18,arsoftid,Bantal Duduk P30L30T6 Biru via @bukalapak https://t.co/uHEEGbbfZb,Twitter for Android,2,0,bantal duduk p30l30t6 biru via
5/3/2020 18:35,1.25691E+18,jwuxxx,"yg lagi rame pembobolan tokopedia, pas di cek malah bukalapak udah kebobol 1taun yg lalu :' https://t.co/QHqhct19V2",Twitter for Android,1,1,yg lagi rame bobol tokopedia pas di cek malah bukalapak udah bobol 1taun yg lalu
5/3/2020 18:34,1.25691E+18,farhanpradana16,Jingan emng  #bukalapak https://t.co/owvd7zALmv,Twitter for Android,1,1,jingan emng
5/3/2020 18:34,1.25691E+18,merahganda,"@alfsarii Beda dong, yg gue kan edmodo sm canva, lu mah bukalapak sm edmodo. Ini akun edmodo pas matkul pak sandi ya.",Twitter for Android,1,0,beda dong yg gue kan edmodo sm canva lu mah bukalapak sm edmodo ini akun edmodo pas matkul pak sandi ya
5/3/2020 18:33,1.25691E+18,FriskaMarpaun12,Bukan di  #Tokopedia ataupun #bukalapak  malah di dubsmash -_- https://t.co/HfIgsfGyA2,Twitter for iPhone,6,0,bukan di atau malah di dubsmash
5/3/2020 18:33,1.25691E+18,yashwon99,@BukaBantuan Saya dak tahu sdh delivered atau blm ?? Krn system bukalapak dak jalan.. kok selalu begini ya,Twitter for Android,0,0,saya dak tahu sdh delivered atau blm krn system bukalapak dak jalan kok selalu begini ya
5/3/2020 18:33,1.25691E+18,nenianggg,"@nikkoilham Canva, bukalapak, eyem ÅEÅEÅE≠",Twitter for Android,1,0,canva bukalapak eyem
5/3/2020 18:32,1.25691E+18,nashikinhakim,Pengen kaya gini. Di Bukalapak sama #Tokopedia ada gak ya? https://t.co/DA3n7QlJp7,Twitter for Android,9,1,ken kaya gin di bukalapak sama ada gak ya
5/3/2020 18:32,1.25691E+18,tobatyukkkk,kalo beli di #tokopedia atau Bukalapak ada ngga?,Twitter for iPhone,1,0,kalo beli di atau bukalapak ada ngga
5/3/2020 18:32,1.25691E+18,asrof_vickyr,Bukalapak aku kebobol setelah aku mengeceknya https://t.co/slwjxKujpn,Twitter for Android,1,0,bukalapak aku bobol telah aku ecek
5/3/2020 18:32,1.25691E+18,cleocatraaa,@satriaoo Bukalapak ya nakal,Twitter for Android,0,0,bukalapak ya nakal
