tweet_time,tweet_id,username,tweet_text,source,favourite,retweet,clean
5/3/2020 20:38,1.25694E+18,YahBadawi,"Abis ngecek di https://t.co/ghNHJdd9G3, pake email boneka Alhamdulillah cm canva  #bukalapak  #Tokopedia https://t.co/mjrmhrlyBt",Twitter for Android,0,0,abis ngecek di pake email boneka alhamdulillah cm canva
5/3/2020 20:37,1.25694E+18,warga_ples62,Banyak orang bersetatus odp : orang drop penghasilan  Naik status jd pdp : positif dia pengangguran  Akhirnya positif corona : condisi rontok dana  Malah ditambahin PSBB : pekerjaan susah beban banyak  Bukalapak,Twitter Web App,3,1,banyak orang bersetatus odp orang drop hasil naik status jd pdp positif dia anggur akhir positif corona condisi rontok dana malah ditambahin psbb kerja susah beban banyak bukalapak
5/3/2020 20:37,1.25694E+18,Nada_QS,@alyaadlh Al emgnya lu punya akun bukalapak?,Twitter for Android,0,0,al emgnya lu punya akun bukalapak
5/3/2020 20:37,1.25694E+18,KimDiinda,@jeyyyhobiii gk punya Tokopedia or Bukalapak,Twitter for Android,1,0,gk punya tokopedia or bukalapak
5/3/2020 20:37,1.25694E+18,GhessyPratiwi,Gilsss bukalapak banyak yg bocor nih feb 2018. Termasuk akun bukalapak gue pun. https://t.co/3Ja83VQm0p,Twitter for Android,0,0,gilsss bukalapak banyak yg bocor nih feb 2018 masuk akun bukalapak gue pun
5/3/2020 20:37,1.25694E+18,BukaBantuan,"@adrianadra_ Baik Kak, dengan senang hati Bella informasikan untuk menonaktifkan akun Bukalapak silakan untuk ke Bukabantuan pada aplikasi Bukalapak milik Kakak atau silakan akses https://t.co/3uwfxeczlw ^MA",Ivosights - Sociomile,0,0,baik kak dengan senang hati bella informasi untuk nonaktif akun bukalapak sila untuk ke bukabantuan pada aplikasi bukalapak milik kakak atau sila akses ma
5/3/2020 20:37,1.25694E+18,Jimly_Minority,Udah jarang liat iklan Bukalapak di tv.,Twitter for Android,0,0,udah jarang liat iklan bukalapak di tv
5/3/2020 20:36,1.25694E+18,RahDeSedana,"@fuaaaadss @secgron @bukalapak Iya nih, aku juga malah yg di bukalapak.... ÅEÅE§ÅE",Twitter Web App,0,0,iya nih aku juga malah yg di bukalapak
5/3/2020 20:36,1.25694E+18,yohnatan14,@yrdisme @SejarahRI Bukalapak...,Twitter for iPhone,0,0,bukalapak
5/3/2020 20:36,1.25694E+18,baskoronurd,"Bukalapak dan Tokopedia karya anak bangsa, mari kita selamatkan",Twitter for iPhone,0,0,bukalapak dan tokopedia karya anak bangsa mari kita selamat
5/3/2020 20:36,1.25694E+18,agunsux,Bukalapak juga kena? ÅEÅEÅEÅE,Twitter for Android,0,0,bukalapak juga kena
5/3/2020 20:36,1.25694E+18,jeyyyhobiii,Temen2 pad ke hack dr bukalapak sm tokped gw buru2 cek ganti semua akun gmail shhsh https://t.co/NL8gBFq5d7,Twitter for Android,1,1,temen2 pad ke hack dr bukalapak sm tokped gw buru2 cek ganti semua akun gmail shhsh
5/3/2020 20:34,1.25694E+18,kusniawan_bam,Piye iki min? @bukalapak @BukaBantuan https://t.co/3gDaCyfeqr,Twitter for Android,0,0,piye iki min
5/3/2020 20:34,1.25694E+18,IlhamAkbar_ID,@apriistya Maksudnya #Bukalapak mu kena juga (?),Twitter for Android,0,0,maksud mu kena juga
5/3/2020 20:33,1.25694E+18,CisadaneLaskar,Ribuan Data User Tokopedia Dijual Rp 74 Juta di Dark Web _______________ 91 juta data pengguna dan lebih dari tujuh juta data merchant Tokopedia dilaporkan dijual di situs gelap (dark web). atau Rp 74 juta (kurs Rp 14.961). Video @KompasTV #bukalapak #LulusJalurCorona #Tokopedia https://t.co/GNKuJX5WRH,Twitter for Android,4,2,ribu data user tokopedia jual rp 74 juta di dark web 91 juta data guna dan lebih dari tujuh juta data merchant tokopedia lapor jual di situs gelap dark web atau rp 74 juta kurs rp 14961 video
5/3/2020 20:33,1.25694E+18,ijuluji,"@mujhsheee @mariplek @alfizinarf Sementara yang paling mudah cuma satu. Ganti password dari email di semua akun, apa pun itu, yang sama dengan di Bukalapak atau Tokped.",Twitter for Android,3,1,sementara yang paling mudah cuma satu ganti password dari email di semua akun apa pun itu yang sama dengan di bukalapak atau tokped
5/3/2020 20:33,1.25694E+18,tikanyol,Orang2 pd ngecek yg kebobol tokped sm bukalapak. Aku kok edmodo yo? Wkwk,Twitter for Android,0,0,orang2 pd ngecek yg bobol tokped sm bukalapak aku kok edmodo yo wkwk
5/3/2020 20:32,1.25694E+18,tsyazhr,"@Nathania_Sheila Oh ak tau caranya, coba pap hp nya lengkap sama charger, dusbook, dan semuanya. Abistu diupload ke shopee/tokped/bukalapakÅEÅEÅE≠",Twitter for Android,0,0,oh ak tau cara coba pap hp nya lengkap sama charger dusbook dan semua abistu diupload ke shopeetokpedbukalapak
5/3/2020 20:32,1.25694E+18,gdarkness15,"Edmodo pernah kena ya, email steam pula ini. email back up lainnya juga kena yang bukalapak kemaren. Untung aja yang utama aman. https://t.co/qbi03z7Mv1 https://t.co/gDPJ5ie57b",Twitter Web App,0,0,edmodo pernah kena ya email steam pula ini email back up lain juga kena yang bukalapak kemaren untung aja yang utama aman
5/3/2020 20:32,1.25694E+18,audryan_belle,@AdiUswanto Lah gua malah bukalapak ih ini gimana dong:( https://t.co/CbrUVrqrHd,Twitter for iPhone,0,0,lah gua malah bukalapak ih ini gimana dong
5/3/2020 20:31,1.25694E+18,haduuhpusing,Loh bukalapak juga,Twitter for Android,0,0,loh bukalapak juga
5/3/2020 20:31,1.25694E+18,jellicle_pup,@Lofiubiii @airairarii @bukalapak Terima kasih kamu baik sekali :),Twitter for iPhone,0,0,terima kasih kamu baik sekali
5/3/2020 20:30,1.25694E+18,ihnalfmuh,@topikuniiiiing Bukalapak juga.,Twitter for Android,0,0,bukalapak juga
5/3/2020 20:30,1.25694E+18,agungnugrohoo17,@alfizinarf Kena tokoed aama bukalapak. Gimana ya cara nanganinnya? https://t.co/tcSixFPySf,Twitter for Android,0,0,kena tokoed aama bukalapak gimana ya cara nanganinnya
5/3/2020 20:29,1.25694E+18,intanrn,"Abis ikutan ngecek di Mozilla sama haveibeenpwned, dua duanya nunjukin leaked di sephora canva sama bukalapak, tp apps ini udah lama bgt gue apus, gmn ya? Ada yg tau apa emg udah biarin aja?",Twitter for iPhone,0,0,abis ikut ngecek di mozilla sama haveibeenpwned dua dua nunjukin leaked di sephora canva sama bukalapak tp apps ini udah lama bgt gue apus gmn ya ada yg tau apa emg udah biarin aja
5/3/2020 20:29,1.25694E+18,DanDaniAja,"Lagi ribut tokped, ketika dicheck kenapa yang muncul bukalapak hmm . no more privacy in this world. Don't be naive",Twitter for Android,0,0,lagi ribut tokped ketika dicheck kenapa yang muncul bukalapak hmm no more privacy in this world dont be naive
5/3/2020 20:28,1.25694E+18,reusdav,views shindong wayv #LulusJalurCorona kanan kiri ferdian paleka nct bts exo layout army suggest bio berkah suara jungkook #Tokopedia bukalapak shopee https://t.co/D9XbQv1GM8,Twitter for iPhone,0,0,views shindong wayv kanan kiri ferdian paleka nct bts exo layout army suggest bio berkah suara jungkook bukalapak shopee
5/3/2020 20:28,1.25694E+18,BukaBantuan,"@Andi56771178 Baik kak, Bella ikut senang jika kendala kakak sudah teratasi. ÅEÅEÅEÅE Kalo ada kendala atau pertanyaan lagi mengenai Bukalapak silakan infokan ke Bella ya kak. ÅEÅEÅEÅE ^WN",Ivosights - Sociomile,0,0,baik kak bella ikut senang jika kendala kakak sudah atas kalo ada kendala atau tanya lagi kena bukalapak sila info ke bella ya kak wn
5/3/2020 20:27,1.25694E+18,indahhhpees,@BukaBantuan @bukalapak Cek DM kakanya,Twitter for Android,0,0,cek dm kakanya
5/3/2020 20:27,1.25694E+18,977b8d98044b4c6,"@DeniKuda @nastargulungg @cokelatbutir Kak kalau akun bukalapak nya udh ngak bisa ganti pswd aman ngak,soal https://t.co/9SSbqKZAme.hp nya udah berubah sendiri,jadi ngak bisa verifikasi",Twitter Web App,0,0,kak kalau akun bukalapak nya udh ngak bisa ganti pswd aman ngaksoal nya udah ubah sendirijadi ngak bisa verifikasi
5/3/2020 20:26,1.25694E+18,adtya_pr,Tokped kena hack Bukalapak udh lama ketinggalan  Shopee gaada lawan skrng wkwk,Twitter for Android,0,0,tokped kena hack bukalapak udh lama tinggal shopee gaada lawan skrng wkwk
5/3/2020 20:26,1.25694E+18,95KJISOOWG,@ceonsomi_ @00SOOBINWG Disini bukan bukalapak tapi shopee .g,Twitter for Android,0,0,sini bukan bukalapak tapi shopee g
5/3/2020 20:26,1.25694E+18,andriantri_,"kemaren kemaren Bukalapak buming, sekarang Tokopedia gantian Buming. hmmmmmmmmmmmmmm",Twitter Web App,0,0,kemaren kemaren bukalapak buming sekarang tokopedia ganti buming hmmmmmmmmmmmmmm
5/3/2020 20:25,1.25694E+18,_oktianokti,Cek lagi hasilnya gini. Setaun kebobolan bukalapak dan gatau buat apaan data ku :(( https://t.co/UqOpFx4Zg6,Twitter for Android,0,0,cek lagi hasil gin taun bobol bukalapak dan gatau buat apa data ku
5/3/2020 20:24,1.25694E+18,JohnnyTheStrong,@underthebreach @tokopedia Siap-siap permintaan kode rahasia melalui HP. Kejadian sama dengan Bukalapak.,Twitter Web App,0,0,siapsiap minta kode rahasia lalu hp jadi sama dengan bukalapak
5/3/2020 20:23,1.25694E+18,jodypati,sekarang trendingnya bukalapak hmmmm,Twitter Web App,0,0,sekarang trendingnya bukalapak hmmmm
5/3/2020 20:23,1.25694E+18,fujiramdoni,Tokopedia x Bukalapak,Twitter for Android,2,0,tokopedia x bukalapak
5/3/2020 20:23,1.25694E+18,BukaBantuan,"@diceIupinn_ Hai kak, maaf banget nih sebelumnya. Pihak Bukalapak berupaya menjaga kerahasiaan pengguna. Untuk hal tersebut mohon sedianya menunggu info atau update terbaru dari Bukalapak terlebih dahulu, ya. Bella akan bantu p.. https://t.co/AX1ENMcLC1",Ivosights - Sociomile,0,0,hai kak maaf banget nih belum pihak bukalapak upaya jaga rahasia guna untuk hal sebut mohon sedia tunggu info atau update baru dari bukalapak lebih dahulu ya bella akan bantu p
5/3/2020 20:23,1.25694E+18,AyaaJKT48,"@secgron Bukalapak juga pernah bocor kah? Soalnya pas cek nggak ada tokped tpi adanya bukalapak, canva, dubsmash, sama ai.type",Twitter for Android,0,0,bukalapak juga pernah bocor kah soal pas cek nggak ada tokped tpi ada bukalapak canva dubsmash sama aitype
5/3/2020 20:23,1.25694E+18,Widyahrdsr,@cokelatbutir anjirr samaa gue juga bukalapak tp ada app yg gue samasekali gak download dongg app younow gilaa si ini,Twitter for Android,0,1,anjirr samaa gue juga bukalapak tp ada app yg gue samasekali gak download dongg app younow gilaa si ini
5/3/2020 20:22,1.25694E+18,sukweinsteiger,@lykethez Bukalapak,Twitter for Android,0,0,bukalapak
5/3/2020 20:22,1.25694E+18,AfrzlDP,"@shafannisya Td cek sih dr Bukalapak, Canva sama Tusfiles. Nah yg baru bgt itu Tusfiles. Padahal web dia udah down dari 2017 kalo ga salah. Yg ke leak password lamaaaaa bgt wkwkwk. Udah gua ganti ca semua-muanya",Twitter for Android,0,0,td cek sih dr bukalapak canva sama tusfiles nah yg baru bgt itu tusfiles padahal web dia udah down dari 2017 kalo ga salah yg ke leak password lamaaaaa bgt wkwkwk udah gua ganti ca semuamuanya
5/3/2020 20:22,1.25694E+18,adrianadra_,cara delete account di bukalapak gimana ya? @BukaBantuan,Twitter for Android,0,0,cara delete account di bukalapak gimana ya
5/3/2020 20:21,1.25694E+18,gcragon,@hwagtiff @from_youngkey Maaf saya team bukalapak,Twitter for iPhone,0,0,maaf saya team bukalapak
5/3/2020 20:20,1.25694E+18,viiure,@tracerbox Bukalapak????,Twitter for Android,0,0,bukalapak
5/3/2020 20:20,1.25694E+18,lymoshining,Ini sih apl jaman kapan udah lama. Perasaan gak masukin gmail deh tpi gak tau sih dah lama juga #bukalapak https://t.co/UsFShYnJp7,Twitter for iPhone,0,1,ini sih apl jaman kapan udah lama asa gak masukin gmail deh tpi gak tau sih dah lama juga
5/3/2020 20:20,1.25694E+18,DlviaR,"Serem bgt sii, kena bobolÅEÅEÅE≠ #Tokopedia #bukalapak https://t.co/jUeW4qoEZW",Twitter for Android,0,0,rem bgt sii kena bobol
5/3/2020 20:19,1.25694E+18,TriArdi05921196,Malah akun ini yang kebobol  #Tokopedia #bukalapak https://t.co/AX5QDO46TD,Twitter Web App,0,0,malah akun ini yang bobol
5/3/2020 20:19,1.25694E+18,aatrok,"Ok Bukalapak , jelaskan  Kemaren pas rame zoom sempet buka sih d pwnd tpi ga diliatin situs yg ngeretas nya apa aja, ternyata..ternyata https://t.co/UQnM8Krip1",Twitter Web App,0,0,ok bukalapak jelas kemaren pas rame zoom sempet buka sih d pwnd tpi ga diliatin situs yg ngeretas nya apa aja ternyataternyata
5/3/2020 20:19,1.25694E+18,wisnujr,"woww tokopedia kenapa serem dah, langsung auto ganti password, hapus kartu kartu di tokopedia, bukalapak, dana, shopee.",Twitter for iPhone,0,0,woww tokopedia kenapa rem dah langsung auto ganti password hapus kartu kartu di tokopedia bukalapak dana shopee
5/3/2020 20:19,1.25694E+18,BukaBantuan,"@Aldoooh3 Hai kak, maaf banget nih sebelumnya. Pihak bukalapak berupaya menjaga kerahasiaan pengguna. Untuk hal tersebut mohon sedianya menunggu info atau update terbaru dari Bukalapak. Mohon konfirmasi email dan nomor telfon y.. https://t.co/qSXcJg6E1A",Ivosights - Sociomile,0,0,hai kak maaf banget nih belum pihak bukalapak upaya jaga rahasia guna untuk hal sebut mohon sedia tunggu info atau update baru dari bukalapak mohon konfirmasi email dan nomor telfon y
5/3/2020 20:18,1.25694E+18,RoadRace2020,"@bukalapak Hanya di lapak tertentu, ga seru...",Twitter for Android,0,0,hanya di lapak tentu ga seru
5/3/2020 20:18,1.25694E+18,bondan_rnldy,@BukaBantuan @se0limit prepare dengan cepat ya min sayang yg buka lapak di bukalapak,Twitter Web App,0,0,prepare dengan cepat ya min sayang yg buka lapak di bukalapak
5/3/2020 20:18,1.25694E+18,tracerbox,anjir canva sm bukalapak bocor juga datanya,Twitter for Android,0,0,anjir canva sm bukalapak bocor juga data
5/3/2020 20:18,1.25694E+18,Luvlyzze,@discountfess Alfa sama bukalapak,Twitter Web App,0,0,alfa sama bukalapak
5/3/2020 20:18,1.25694E+18,victory_ori,"@secgron Lah, email gue malah kedetect disalahgunakan yg @bukalapak ....",Twitter for Android,0,0,lah email gue malah kedetect disalahgunakan yg
5/3/2020 20:18,1.25694E+18,ayamrossayam,"@secgron Udah kena di bukalapak, gak bs di tutup dong akunnya :( https://t.co/47a36u0M2H",Twitter for iPhone,0,0,udah kena di bukalapak gak bs di tutup dong akun
5/3/2020 20:17,1.25694E+18,dinkdankdunk,Td ngecek juga ke leaked di bukalapak ÅEÅEÅEÅE #lrt,Twitter for iPhone,0,0,td ngecek juga ke leaked di bukalapak
5/3/2020 20:17,1.25694E+18,sefdiantoro,"kena juga aku bukalapak sama canva aku. di breach dah lama pula ternyata tahun lalu.  auto ganti password, dll",Twitter Web App,0,0,kena juga aku bukalapak sama canva aku di breach dah lama pula nyata tahun lalu auto ganti password dll
5/3/2020 20:17,1.25694E+18,circleofisnia,@CALukitasari iyak sih ÅEÅE§ÅE bukalapak punyaku td langsung tak ganti  mending nek nggo toko onlen gitu beda pswd sama email utama,Twitter for Android,0,0,iyak sih bukalapak punya td langsung tak ganti mending nek nggo toko onlen gitu beda pswd sama email utama
5/3/2020 20:16,1.25694E+18,BukaBantuan,"@senjaberkabut Hai kak, maaf banget nih sebelumnya. Pihak bukalapak berupaya menjaga kerahasiaan pengguna. Untuk hal tersebut mohon sedianya menunggu info atau update terbaru dari Bukalapak. Mohon konfirmasi email dan nomor tel.. https://t.co/7GeQ0A6RWC",Ivosights - Sociomile,0,0,hai kak maaf banget nih belum pihak bukalapak upaya jaga rahasia guna untuk hal sebut mohon sedia tunggu info atau update baru dari bukalapak mohon konfirmasi email dan nomor tel
5/3/2020 20:16,1.25694E+18,OncefromSwamp,@habibthink Yg dlu ngedukung HTI itu tokped ato bukalapak ya bib? Lupa euy.,Twitter for iPad,0,0,yg dlu ngedukung hti itu tokped ato bukalapak ya bib lupa euy
5/3/2020 20:16,1.25694E+18,bukalapak,"@suhgarplum Hai kak, maaf banget nih sebelumnya. Pihak bukalapak berupaya menjaga kerahasiaan pengguna. Untuk hal tersebut mohon sedianya menunggu info atau update terbaru dari Bukalapak. Mohon konfirmasi email dan nomor telfon.. https://t.co/NYQKqRbc3U",Ivosights - Sociomile,0,0,hai kak maaf banget nih belum pihak bukalapak upaya jaga rahasia guna untuk hal sebut mohon sedia tunggu info atau update baru dari bukalapak mohon konfirmasi email dan nomor telfon
5/3/2020 20:15,1.25694E+18,er1cjo,Usaha McDonald sudah bukan dibesarkan oleh keturunan McDonald. Fun Fact Part 1  #mcdonald #bisnis #saham #fakta #tokopedia #bukalapak #LulusJalurCorona https://t.co/o5ggAUDeUR,Twitter Web App,0,0,usaha mcdonald sudah bukan besar oleh turun mcdonald fun fact part 1
5/3/2020 20:15,1.25694E+18,Aldyka_Herrera,#Tokopedia #bukalapak https://t.co/KTZGLwO5QB,Twitter for iPhone,0,0,
5/3/2020 20:12,1.25693E+18,muamrzk,@Bloodyjoking @_lulut @fuaaaadss @secgron @bukalapak email di akun yg lama msh dipake kah sampe skrg?,Twitter for Android,0,0,email di akun yg lama msh dipake kah sampe skrg
5/3/2020 20:12,1.25693E+18,pengelana,@gurnadi @dump9x saya 100% yakin data saya enggak ada. **gak pernah bikin akun di toped &amp; bukalapak** ÅEÅEÅEÅEÅEÅEÅEÅEÅEÅEÅEÅE,Twitter Web App,0,0,saya 100 yakin data saya enggak ada gak pernah bikin akun di toped amp bukalapak
5/3/2020 20:12,1.25693E+18,haigeez,"@mstvus Yg gua juga euy sarua, bukalapak",Twitter for Android,0,0,yg gua juga euy sarua bukalapak
5/3/2020 20:12,1.25693E+18,masdep2,Uninstall Bukalapak #masdepID,Twitter Web App,0,0,uninstall bukalapak
5/3/2020 20:12,1.25693E+18,Calon__Mayat,"Mencekam.! Detik-Detik Kapal Hongkong Masuk Ke Perairan Pulau Sembilan, Sumatera Utara, Desa Pulau Sembilan, Kecamatan Pangkalan Susu, Kabupaten Langkat, Minggu (3/5) sekira Jam 11.00 WIB. https://t.co/EMIs6UODQM Tag : Ferdian Paleka Bukalapak #RevolusiHentikanJKW_LBP #Tokopedia",Twitter for Android,31,10,cekam detikdetik kapal hongkong masuk ke air pulau sembilan sumatera utara desa pulau sembilan camat pangkal susu kabupaten langkat minggu 35 sekira jam 1100 wib tag ferdian paleka bukalapak
5/3/2020 20:12,1.25693E+18,andhi_aryadi,"Netijen, please do your magic. Bantu jualan gue di Bukalapak yuk, belinya di sini: https://t.co/l3tfIxiHNS https://t.co/EQ4I2tWvVT",Twitter for Android,0,0,netijen please do your magic bantu jual gue di bukalapak yuk beli di sini
5/3/2020 20:11,1.25693E+18,2OOOHAN,"yang pake canva, tokped, dubsmash, bukalapak, coba cek ini ÅEÅEÅE•ÅEÅEÅE• https://t.co/qZo9JYptcH",Twitter for Android,1,0,yang pake canva tokped dubsmash bukalapak coba cek ini
5/3/2020 20:11,1.25693E+18,Lofiubiii,@jellicle_pup @airairarii @bukalapak https://t.co/7xxYbx2J6c,Twitter for Android,2,0,
5/3/2020 20:11,1.25693E+18,lymoshining,Auto amanin semua akun ÅEÅEÅEÅE#bukalapak #Tokopedia,Twitter for iPhone,0,0,auto amanin semua akun
5/3/2020 20:11,1.25693E+18,bondan_rnldy,"Tokopedia &amp; Bukalapak finish , Shopee bertahanlah dataku ada disanaa",Twitter Web App,0,0,tokopedia amp bukalapak finish shopee tahan data ada disanaa
5/3/2020 20:11,1.25693E+18,andimegame,Wew pernah ke leaked akun Bukalapak saya.. https://t.co/dfttXJTD2f,Twitter for Android,0,0,wew pernah ke leaked akun bukalapak saya
5/3/2020 20:10,1.25693E+18,kucingonlinebdg,Ini bukan pencurian data Bukalapak atau #Tokopedia ya. Just... ngambil mainankuh! ÅEÅEÅEÄ https://t.co/eh7qzjRPPn,Twitter Web App,20,0,ini bukan curi data bukalapak atau ya just ngambil mainankuh
5/3/2020 20:10,1.25693E+18,deviestaa,@bukalapak min cekin dong B1LRHSQH,Twitter Web App,0,0,min cekin dong b1lrhsqh
5/3/2020 20:10,1.25693E+18,indrajaya_levi,@bukalapak leaked since 2018? https://t.co/7O48at2sKf,Twitter for Android,0,0,leaked since 2018
5/3/2020 20:10,1.25693E+18,AdilaLega,@betebeee Padahal baru kemaren dikasi tugas buat compare security toped shopi sama bukalapak sama pak aries,Twitter Web App,0,0,padahal baru kemaren kasi tugas buat compare security toped shopi sama bukalapak sama pak aries
5/3/2020 20:09,1.25693E+18,Give_Gift,"@ynanscy @bukalapak perbanyak konten-konten begini na, sangat menghibur",Twitter Web App,0,0,banyak kontenkonten begini na sangat hibur
5/3/2020 20:09,1.25693E+18,Ranitalikaa,"Ugghh hell no, bukalapakÅEÅEÅEÅE https://t.co/onHJYTUpN5 https://t.co/lXZ43lx6gH",Twitter for Android,0,0,ugghh hell no bukalapak
5/3/2020 20:08,1.25693E+18,aguuses,"@wahyu139 @bukalapak Itu databasenya BL ke hack, tapi password anda telah encrypted sehingga tidak ketahuan oleh hacker",Twitter for iPhone,0,0,itu databasenya bl ke hack tapi password anda telah encrypted sehingga tidak tahu oleh hacker
5/3/2020 20:08,1.25693E+18,HayNaufal,"Tokopedia dan Bukalapak sudah terkena, semoga @ShopeeID gak kenapa-kenapa ya kak..",Twitter for Android,1,0,tokopedia dan bukalapak sudah kena moga gak kenapakenapa ya kak
5/3/2020 20:08,1.25693E+18,ayu_masi,@dee1Libby1Me aku 2 dong bukalapak sama canva -_-,Twitter for Android,0,0,aku 2 dong bukalapak sama canva
5/3/2020 20:07,1.25693E+18,habibthink,"Untungnya di ecommerce seperti tokped, bukalapak, dsb udah dilengkapi fitur OTP, untuk menjaga keamanan bertransaksi.  Jadi penggunaan saldo ovo maupun kartu kredit harusnya aman. Selama kode OTP tidak kita serahkan kepada siapapun.",Twitter for Android,11,4,untung di ecommerce seperti tokped bukalapak dsb udah lengkap fitur otp untuk jaga aman transaksi jadi guna saldo ovo maupun kartu kredit harus aman lama kode otp tidak kita serah kepada siapa
5/3/2020 20:06,1.25693E+18,ynanscy,Lagu favorite Ilona dari umur 6 bulanÅEÅE§£ÅEÅE§£  @bukalapak please notice her!!! Ayo twitter do your magicÅEÅE§™ÅEÅE§™ https://t.co/cIXFPOfocc,Twitter for iPhone,22,4,lagu favorite ilona dari umur 6 bulan please notice her ayo twitter do your magic
5/3/2020 20:06,1.25693E+18,dianalif___,"@kentangreebus @secgron ÅEøº  Bukalapak: In March 2019, the Indonesian e-commerce website¬†Bukalapak discovered a data breach of the organisation's backups dating back to October 2017. The incident exposed approximately 13 million unique email addresses al",Twitter for Android,0,0,bukalapak in march 2019 the indonesian ecommerce website bukalapak discovered a data breach of the organisations backups dating back to october 2017 the incident exposed approximately 13 million unique email addresses alongside ip addresses names and passwords stored
5/3/2020 20:05,1.25693E+18,masinusina,"@BukaBantuan Sy mau hapus akun bukalapak dan data pribadi seperti email dan no hp apakah bisa? Kalo bisa, sy akan DM.",Twitter for iPhone,0,0,sy mau hapus akun bukalapak dan data pribadi seperti email dan no hp apakah bisa kalo bisa sy akan dm
5/3/2020 20:05,1.25693E+18,kalimayafashion,Bukalapak  kalimayafashion https://t.co/6axxIZEr2Z https://t.co/9XF3QTeMTe,Twitter for Android,2,0,bukalapak kalimayafashion
5/3/2020 20:04,1.25693E+18,wahyu139,Mohon konfirmasi @bukalapak Apakah benar ada kebocoran data sy di bulan Feb 2018 sama Maret 2019? Sama mohon informasi cara hapus akun ya @bukalapak https://t.co/xqZIREayCb,Twitter for Android,0,0,mohon konfirmasi apakah benar ada bocor data sy di bulan feb 2018 sama maret 2019 sama mohon informasi cara hapus akun ya
5/3/2020 20:04,1.25693E+18,BukaBantuan,"@masinusina Baik Kak, mohon maaf atas kendalanya. Bella akan bantu cek akun Kakak, ya. Bisa diinformasikan melalui pesan alamat email dan nomor telepon yang terdaftar di Bukalapak agar dapat Bella bantu cek, ya. :) ^IR",Ivosights - Sociomile,0,0,baik kak mohon maaf atas kendala bella akan bantu cek akun kakak ya bisa informasi lalu pesan alamat email dan nomor telepon yang daftar di bukalapak agar dapat bella bantu cek ya ir
5/3/2020 20:04,1.25693E+18,ardiynt,"Lanjut. Pantesan aja beberapa hari yang lalu tiba-tiba ada yg login ke akun surel gw, dari lokasi yg google kasih ke gw alamat ip nya dari mesir. Berarti kebocoran akun di bukalapak lebih serem, karena bener-bener bisa login ke email gw. https://t.co/QsoBttmunt",Twitter for Android,0,0,lanjut pantesan aja beberapa hari yang lalu tibatiba ada yg login ke akun surel gw dari lokasi yg google kasih ke gw alamat ip nya dari mesir arti bocor akun di bukalapak lebih rem karena benerbener bisa login ke email gw
5/3/2020 20:04,1.25693E+18,Don_Arturo11,Bukalapak sama Tokopedia sehat? Astaga.,Twitter for Android,0,0,bukalapak sama tokopedia sehat astaga
5/3/2020 20:04,1.25693E+18,ddratrin,@skmlwt Bukalapak juga kan?,Twitter for Android,0,0,bukalapak juga kan
5/3/2020 20:04,1.25693E+18,kuekejugaring,@KediriFess ga nggae tokped kambek bukalapak sih,Twitter Web App,0,0,ga nggae tokped kambek bukalapak sih
5/3/2020 20:04,1.25693E+18,adiartanti1,Binggo.. Bukalapak nihh.. Dubsmash ya ampun lama bgt make itu thn 2016 deh sekali tu juga ÅEÅE§ÅE https://t.co/38eJwL1o2V,Twitter for Android,0,0,binggo bukalapak nihh dubsmash ya ampun lama bgt make itu thn 2016 deh sekali tu juga
5/3/2020 20:04,1.25693E+18,devideponggg,"@matchateavana Klo udh uninstal otomatis logout kan dri akun nya? Ak lupa lazada, tokped, bukalapak udah hapus akun apa blum sblum uninstal uu",Twitter for Android,0,0,klo udh uninstal otomatis logout kan dri akun nya ak lupa lazada tokped bukalapak udah hapus akun apa blum sblum uninstal uu
5/3/2020 20:03,1.25693E+18,bucinrexx,"Wow bener bener ya, daritadi yang gue liat bukalapak semuaÅEÅE§ØÅEÅE§Ø https://t.co/grLRwJinET",Twitter for Android,0,0,wow bener bener ya daritadi yang gue liat bukalapak semua
5/3/2020 20:03,1.25693E+18,Beniaryo87,Wah cek tokped gak ada ternyata bukalapak bocor https://t.co/3dzHfbMTw3,Twitter for iPhone,0,0,wah cek tokped gak ada nyata bukalapak bocor
5/3/2020 20:03,1.25693E+18,Bloodyjoking,@_lulut @fuaaaadss @secgron @bukalapak Sy verifikasi no nya aktip mas sedangkan no sy udah angus. Jd tiap login hrs masukin kode otp yg dikirim ke no kita nah sdgkn no nya udh angus mas,Twitter for Android,3,0,sy verifikasi no nya aktip mas sedang no sy udah angus jd tiap login hrs masukin kode otp yg kirim ke no kita nah sdgkn no nya udh angus mas
5/3/2020 20:03,1.25693E+18,aribkhri,Ini kenapa data bisa bocor di tokopedia bukalapak?  Mungkin bisnisnya gini kali yak: kita dikasi diskon dan gratis ongkir tapi data kita dijual.. wkwk,Twitter for Android,0,0,ini kenapa data bisa bocor di tokopedia bukalapak mungkin bisnis gin kali yak kita kasi diskon dan gratis ongkir tapi data kita jual wkwk
5/3/2020 20:03,1.25693E+18,ukhrasm,"Alhamdulillah bagi mereka yg punya akun tokped  Btw akun Canva, Myspace, Zomato, Bukalapak apakabar nih. Password udh ter enkripsi (berita bbrp tahun lalu) https://t.co/epyCjbUyXO",Twitter for Android,0,0,alhamdulillah bagi mereka yg punya akun tokped btw akun canva myspace zomato bukalapak apakabar nih password udh ter enkripsi berita bbrp tahun lalu
