tweet_time,tweet_id,username,tweet_text,source,favourite,retweet,clean
2020-05-04 05:19:24,1257072292976193538,thasantuy25,Bantu siram tanamanku. Kamu juga bisa panen THR total 10M di Shopee sekarang! @ShopeeID  #ShopeeTanamTHR10M https://t.co/ArbURvE1bn https://t.co/X4K9XgzAtP,Twitter for Android,1,0,bantu siram tanam kamu juga bisa panen thr total 10m di shopee sekarang
2020-05-04 05:19:23,1257072287825575936,Tocheng666,@antihornytabs Urmmm ada jual kt shopee tak yg kaler ikut tone kulit,Twitter for Android,1,0,urmmm ada jual kt shopee tak yg kaler ikut tone kulit
2020-05-04 05:19:22,1257072283790819334,bysharkdudu,"@justafangrls Wish me luck, mau co shopee hehe💜",Twitter for Android,0,0,wish me luck mau co shopee hehe
2020-05-04 05:19:14,1257072252111077376,Lesyeuxdelavie,@GAMEREFF https://t.co/a6xfdfaUC5,Twitter Web App,0,0,
2020-05-04 05:19:08,1257072223468191744,muayka99,แดนซ์ไปกับน้องโชกี้ แจกฟรีทุกวัน! Shopee coins และโค้ดส่งฟรี https://t.co/oqhxT7VQTw https://t.co/4xEC5xVitY,Twitter for Android,0,0,shopee coins
2020-05-04 05:19:04,1257072209765359616,vandawpa,Saya menjual Paket Bundle ... seharga Rp55.000. Dapatkan produk ini hanya di Shopee! https://t.co/gXBSobutwn #ShopeeID https://t.co/XzwA1yif5b,Shopee_ID,0,0,saya jual paket bundle harga rp55000 dapat produk ini hanya di shopee
2020-05-04 05:19:01,1257072195697688576,adamkosnan,https://t.co/OPooi5nMXG wokay this is still a better choice.,Twitter for Android,0,0,wokay this is still a better choice
2020-05-04 05:18:51,1257072154186625030,zettedevigo_,Shopee : https://t.co/R0O3UHqoDi,twittbot.net,0,0,shopee
2020-05-04 05:18:43,1257072122230276096,vnyztore,"@onedfess Hello directioners yuk mampir ke IG vnyztore ada banyak kumpulam merch 1D adn theboys lohh, via shopee &amp; tokped bisa banget tinggal search aja navienidshop :)) https://t.co/uscXDI0iJ8",Twitter for iPhone,0,0,hello directioners yuk mampir ke ig vnyztore ada banyak kumpulam merch 1d adn theboys lohh via shopee amp tokped bisa banget tinggal search aja navienidshop
2020-05-04 05:18:40,1257072106572931072,bronzzcaley,@GAMEREFF yok ntar di back https://t.co/sK5DQaEs29,Twitter for Android,0,0,yok ntar di back
2020-05-04 05:18:24,1257072039745052673,yoctavia_,Yee cari aja di shopee,Twitter for Android,0,0,yee cari aja di shopee
2020-05-04 05:18:23,1257072038121893890,seblakbasahhh,@GAMEREFF Mampir yu pasti di sirbal https://t.co/zVcGCZmiOJ,Twitter for Android,0,0,mampir yu pasti di sirbal
2020-05-04 05:17:53,1257071909985873920,hangyulshiiii,@kirataokded @FOODFESS2 Kalo online di shopee adaa klo offline di aeonn,Twitter for iPhone,0,0,kalo online di shopee adaa klo offline di aeonn
2020-05-04 05:17:51,1257071902473875456,baconbyn,ni si goblok ada ada aja bikin story di shopee😀😭 https://t.co/Z2mH7V4VVM,Twitter for Android,0,1,ni si goblok ada ada aja bikin story di shopee
2020-05-04 05:17:45,1257071878809645056,3amsuggestion,kocak bgt tiap jam buka shopee:(,Twitter Web App,0,0,kocak bgt tiap jam buka shopee
2020-05-04 05:17:44,1257071871196979200,ayu_afridah,#ShopeeTanam #ShopeeTanamTHR10M  @ShopeeID  https://t.co/8038uoS9NE,Twitter Web App,0,0,
2020-05-04 05:17:43,1257071870660104193,RR_WUW,Shopee Tanam auto siram balik kok. Semangat  Bantu siram tanamanku. Kamu juga bisa panen THR total 10M di Shopee sekarang! https://t.co/cdt00mSWjh https://t.co/TFFb52OPft,Twitter for Android,0,0,shopee tanam auto siram balik kok semangat bantu siram tanam kamu juga bisa panen thr total 10m di shopee sekarang
2020-05-04 05:17:40,1257071856651124736,wardah78540561,Ayo main Shopee Lempar dan dapatkan Voucher Cashback s/d 100% https://t.co/v3dJGtEKBy https://t.co/DFoID7F0vA,Shopee_ID,0,0,ayo main shopee lempar dan dapat voucher cashback sd 100
2020-05-04 05:17:29,1257071811709112320,indhtr_,Bantu siram tanamanku. Kamu juga bisa panen THR total 10M di Shopee sekarang! https://t.co/7RYRLgvtrQ https://t.co/OpVoEvQjUV,Twitter for Android,0,0,bantu siram tanam kamu juga bisa panen thr total 10m di shopee sekarang
2020-05-04 05:17:28,1257071804872523777,glangrmdn,Bantu siram tanamanku. Kamu juga bisa panen THR total 10M di Shopee sekarang! https://t.co/A0xYSdpxJL https://t.co/ieHOGR8aAa,Twitter for Android,0,0,bantu siram tanam kamu juga bisa panen thr total 10m di shopee sekarang
2020-05-04 05:17:25,1257071793086611459,bysharkdudu,"@boobasrtwtine Wish me luck co shopee, semoga win bahagia dan sehat terus! Begitupun kamu hehe😄",Twitter for Android,0,1,wish me luck co shopee moga win bahagia dan sehat terus begitu kamu hehe
2020-05-04 05:17:23,1257071786325184512,hananeneng,Bantu siram tanamanku. Kamu juga bisa panen THR total 10M di Shopee sekarang! https://t.co/PZttKIOLZy https://t.co/ahFpHGOl53,Twitter for Android,0,0,bantu siram tanam kamu juga bisa panen thr total 10m di shopee sekarang
2020-05-04 05:17:05,1257071711192670209,WanAdli_,@frznaj saya beli di shopee 😊,Twitter for iPhone,0,0,saya beli di shopee
2020-05-04 05:17:00,1257071689529085952,glossygypsy,banyak benda aku nak buat tapi tak terbuat salah satunya ni sbb aku terjumpa beginner set ni dekat shopee pastu diy miniature hmmmmm https://t.co/hxRAP0ZAWd,Twitter for iPhone,0,0,banyak benda aku nak buat tapi tak buat salah satu ni sbb aku jumpa beginner set ni dekat shopee pastu diy miniature hmmmmm
2020-05-04 05:16:58,1257071679865384960,fadhilahaluwi,biasa scroll shopee tp dkpe ah tido je lah mana tau mmpi beli brg tu pstu ttibe smpai dpn rmh kekgi 🤪,Twitter for Android,0,0,biasa scroll shopee tp dkpe ah tido je lah mana tau mmpi beli brg tu pstu ttibe smpai dpn rmh kekgi
2020-05-04 05:16:53,1257071657866235904,ranett23,@GAMEREFF https://t.co/dw9YNC8jlK,Twitter for Android,0,0,
2020-05-04 05:16:50,1257071647137251328,Lvdrrrrr,Bantu siram tanamanku. Kamu juga bisa panen THR total 10M di Shopee sekarang! https://t.co/hmJ4LhIqGM  #ShopeeTanamTHR10M #shopeetanam https://t.co/KiE55CVjEc,Twitter for Android,0,0,bantu siram tanam kamu juga bisa panen thr total 10m di shopee sekarang
2020-05-04 05:16:47,1257071633342140416,hadehsupray,"@Husen_Jafar @TretanMuslim Habib, mohon maaf. Mohon maaf 🙏 Saya izin menjual celana chino yang murahh. insyaaAllah barang cakep. Bahan nya juga oke cuma 85k aja bib beda jauh sama yang lain 🙏 bisa beli di shopee juga  makasih banyak bib, semoga selalu sehat https://t.co/WCgz9GakYJ https://t.co/LyIp8MU3sK",Twitter for Android,13,1,habib mohon maaf mohon maaf saya izin jual celana chino yang murahh insyaaallah barang cakep bahan nya juga oke cuma 85k aja bib beda jauh sama yang lain bisa beli di shopee juga makasih banyak bib moga selalu sehat
2020-05-04 05:16:45,1257071626148966400,Tattatam,Saya menjual Ld. Daster L... seharga Rp103.000. Dapatkan produk ini hanya di Shopee! https://t.co/pJicBPhkQy #ShopeeID https://t.co/t6SKaYQ3PM,Shopee_ID,0,0,saya jual ld daster l harga rp103000 dapat produk ini hanya di shopee
2020-05-04 05:16:44,1257071621992361984,carahnawi,macam macam pesen manusia ye dekat feedback shopee ni😂,Twitter for iPhone,1,0,macam macam sen manusia ye dekat feedback shopee ni
2020-05-04 05:16:34,1257071580665937920,ilanurfadilaah,"Bantu siram yuk kak, di siram balik ko pasti! Hehe  #Shopeetanam #ShopeeTanam10M  #shopeetanamkilat #ShopeeID  https://t.co/4Cl10oemyC https://t.co/lns0rdKCSG",Twitter for Android,0,0,bantu siram yuk kak di siram balik ko pasti hehe
2020-05-04 05:16:32,1257071572273074177,horangah,"@baconbyn Yahh😔😔😔 gue ngepost stream ridin tbtb udh 11 aja yg ngeseen, gue kira story shopee privat 😔",Twitter for Android,0,0,yahh gue ngepost stream ridin tbtb udh 11 aja yg ngeseen gue kira story shopee privat
2020-05-04 05:16:29,1257071557655973888,diorsauva9e,"@SilvyMI @ohmybeautybank Shopee.  Iya, emang di situ yang paling murah, lagi sold sekarang.",Twitter for iPhone,0,0,shopee iya emang di situ yang paling murah lagi sold sekarang
2020-05-04 05:16:26,1257071544729104384,yunaitid_,@SYOPIFESS yuk nder https://t.co/eNAIfjcdcb,Twitter for Android,0,0,yuk nder
2020-05-04 05:16:23,1257071534276919296,hiibby_,@Yudaptraa keranjang shopee,Twitter for Android,0,0,keranjang shopee
2020-05-04 05:16:22,1257071528929198080,nitaaa41_,Bantu siram tanamanku. Kamu juga bisa panen THR total 10M di Shopee sekarang! https://t.co/IxI976SXai https://t.co/wdcC55trAp,Twitter for Android,0,0,bantu siram tanam kamu juga bisa panen thr total 10m di shopee sekarang
2020-05-04 05:16:22,1257071527352078336,miaaaoouuww,@GAMEREFF https://t.co/hE4mFwu30Y,Twitter for Android,0,0,
2020-05-04 05:16:20,1257071522616754176,HakakSyue,I'm selling MELKY EFFECT PROMO RAYA 2020 ( BELI... for RM0.00. Get it on Shopee now! https://t.co/Ag2NR5D6Mr #ShopeeMY https://t.co/QSIu87tone,Shopee_MY,0,0,im selling melky effect promo raya 2020 beli for rm000 get it on shopee now
2020-05-04 05:16:20,1257071518829273088,ali_srgr,@Sinta_Rahma22 Siram balik  https://t.co/64aENE7XBZ,Twitter for Android,0,0,siram balik
2020-05-04 05:16:18,1257071510566473728,NA2NONz,@SYOPIFESS https://t.co/IZ4um572lp,Twitter for Android,0,0,
2020-05-04 05:16:15,1257071499174834177,vaniayana_,@GAMEREFF Auto back yuk yuk https://t.co/TRskp0Ls57,Twitter for Android,0,0,auto back yuk yuk
2020-05-04 05:16:13,1257071493554425856,syifaazrya,"Diduga karna gabut, aku siram tanaman shopee sampai gumoh 😂",Twitter for Android,0,0,duga karna gabut aku siram tanam shopee sampai gumoh
2020-05-04 05:16:10,1257071479188905984,jjapproject,@SYOPIFESS https://t.co/AwVN108QK5,Twitter for Android,0,0,
2020-05-04 05:16:03,1257071450831257601,TiensStore09,Saya menjual Pasta gigi t... seharga Rp100.000. Dapatkan produk ini hanya di Shopee! https://t.co/AEwqVf48Ht #ShopeeID https://t.co/UiV8jf2ZXZ,Shopee_ID,0,0,saya jual pasta gigi t harga rp100000 dapat produk ini hanya di shopee
2020-05-04 05:16:01,1257071440223846400,jjapproject,@SYOPIFESS https://t.co/AwVN108QK5,Twitter for Android,0,0,
2020-05-04 05:15:51,1257071399484588032,ThanapitDhamma4,"ขาย แผ่นกรองอากาศแอมเวย์1Air filter Amway 1(Hepa+carbon)2แผ่น(ขนาดพอดีเป๊ะ) ในราคา ฿2,690 ใน #ShopeeTH ตอนนี้! https://t.co/DIh6yLztbS https://t.co/nBZbsYgBcJ",Twitter for Android,0,0,1air filter amway 1hepacarbon2 2690
2020-05-04 05:15:47,1257071382824796160,FriskaNirmala,Bantu siram tanamanku. Kamu juga bisa panen THR total 10M di Shopee sekarang! https://t.co/7GW50OWOML https://t.co/o1YhD7X6dM,Twitter for Android,0,0,bantu siram tanam kamu juga bisa panen thr total 10m di shopee sekarang
2020-05-04 05:15:43,1257071364453752832,wardah78540561,"Jaga Diri, Keluarga dan Orang Sekitar dari COVID-19! https://t.co/xf8Xz38NGC https://t.co/3w0GKQRjYS",Shopee_ID,0,0,jaga diri keluarga dan orang sekitar dari covid19
2020-05-04 05:15:38,1257071346569248768,BukuAgen,Saya menjual Buku Keagunga... seharga Rp31.000. Dapatkan produk ini hanya di Shopee! https://t.co/IgLrKLqEoV #ShopeeID https://t.co/gFYsWqDFLZ,Shopee_ID,0,0,saya jual buku keagunga harga rp31000 dapat produk ini hanya di shopee
2020-05-04 05:15:31,1257071314914832390,syfqhzalzalah,@AjeerahZaharin Laa awat tak beli teruihh dekat website dia? Aku beli kat situ jaa. Macam mana kau boleh terfikir nak beli dekat shopee? 😂,Twitter for iPhone,0,0,laa awat tak beli teruihh dekat website dia aku beli kat situ jaa macam mana kau boleh terfikir nak beli dekat shopee
2020-05-04 05:15:25,1257071291569287169,trashykoun,@GAMEREFF Auto sirbal guyss  https://t.co/L8sjVesTwy,Twitter for Android,0,0,auto sirbal guyss
2020-05-04 05:15:23,1257071282849341441,couple_shopee,King and Queen Matching Shirts for Couples #tshirt #couple https://t.co/qvUWftZOU5 https://t.co/gImJZrx6a9,twittbot.net,0,0,king and queen matching shirts for couples
2020-05-04 05:15:09,1257071223785185280,trashykoun,@Asknonym Aku auto sirbal kok tiap ada notif masuk  https://t.co/L8sjVesTwy,Twitter for Android,0,0,aku auto sirbal kok tiap ada notif masuk
2020-05-04 05:15:03,1257071197130387456,w3baek,Bantu siram tanamanku. Kamu juga bisa panen THR total 10M di Shopee sekarang! https://t.co/fUOnOoijjZ https://t.co/iVJmvXp4oi,Twitter for Android,0,0,bantu siram tanam kamu juga bisa panen thr total 10m di shopee sekarang
2020-05-04 05:15:01,1257071189580636160,PoeJolina,Play Shopee Shake to win Shopee coins! Over 5 million coins to be given away from April 18 to May 6. Join now! https://t.co/DXDAoWAxVC https://t.co/CbPMh5FEkI,Twitter for Android,0,0,play shopee shake to win shopee coins over 5 million coins to be given away from april 18 to may 6 join now
2020-05-04 05:15:00,1257071184312545280,KeziaLidya1,Bantu siram tanamanku. Kamu juga bisa panen THR total 10M di Shopee sekarang! https://t.co/8xmfqoEGfn https://t.co/wimDuCFE76,Twitter for Android,0,0,bantu siram tanam kamu juga bisa panen thr total 10m di shopee sekarang
2020-05-04 05:14:58,1257071176095895553,Silvn04,@tehbotolmarjann @skincare_idn Bisa kak. Ini shopeeku yaa  https://t.co/A99R3P1BfX,Twitter for Android,0,0,bisa kak ini shopeeku yaa
2020-05-04 05:14:58,1257071175735205888,asberrr_,@darkbiy @GAMEREFF Sirbal kak https://t.co/4t5UwehuCs,Twitter for Android,0,0,sirbal kak
2020-05-04 05:14:54,1257071160908369920,wardah78540561,"Jaga Diri, Keluarga dan Orang Sekitar dari COVID-19! https://t.co/xf8Xz38NGC https://t.co/k9Zb3zchS9",Shopee_ID,0,0,jaga diri keluarga dan orang sekitar dari covid19
2020-05-04 05:14:51,1257071148803604480,triendang_w,Shopee tanam Bantu siram tanamanku. Kamu juga bisa panen THR total 10M di Shopee sekarang! https://t.co/Wsj2g1101l,Twitter for Android,0,0,shopee tanam bantu siram tanam kamu juga bisa panen thr total 10m di shopee sekarang
2020-05-04 05:14:46,1257071127077064704,icisayang9,Bantu siram tanamanku. Kamu juga bisa panen THR total 10M di Shopee sekarang! https://t.co/vN2u6zhT9w https://t.co/E5ufsHJUCF,Shopee_ID,0,0,bantu siram tanam kamu juga bisa panen thr total 10m di shopee sekarang
2020-05-04 05:14:44,1257071119435051009,ristiamayaang,Bantu siram tanamanku. Kamu juga bisa panen THR total 10M di Shopee sekarang! https://t.co/AS7eyaFb8s https://t.co/HEh4FCdwnh,Twitter for Android,1,0,bantu siram tanam kamu juga bisa panen thr total 10m di shopee sekarang
2020-05-04 05:14:41,1257071105514201088,qu_shop,Saya menjual Parcel kue 38... seharga Rp38.500. Dapatkan produk ini hanya di Shopee! https://t.co/z2ku1xkKRF #ShopeeID https://t.co/eMM2jg1bAl,Shopee_ID,0,0,saya jual parcel kue 38 harga rp38500 dapat produk ini hanya di shopee
2020-05-04 05:14:39,1257071098606186496,hnsymin_,hhhhhh shopee is a dangerous place https://t.co/X7nLIxr7FF,Twitter for Android,0,0,hhhhhh shopee is a dangerous place
2020-05-04 05:14:39,1257071097909932032,trashykoun,@GAMEREFF Auto sirbal nih  https://t.co/L8sjVesTwy,Twitter for Android,0,0,auto sirbal nih
2020-05-04 05:14:39,1257071095632420866,Sukaadancow_,"@kirataokded @FOODFESS2 Di shopee ada, bikin sndiri juga gampang",Twitter for Android,0,0,di shopee ada bikin sndiri juga gampang
2020-05-04 05:14:32,1257071068994506757,bysharkdudu,@Urijongininie Wish me luck mau co shopee😄 https://t.co/HxukKktVjD,Twitter for Android,0,0,wish me luck mau co shopee
2020-05-04 05:14:31,1257071062170378241,tehbotolmarjann,@Silvn04 @skincare_idn Bisa shopee freeong?,Twitter for Android,0,0,bisa shopee freeong
2020-05-04 05:14:22,1257071027999223808,nika_herawati,@ShopeeID Sudah panen berpuluh puluh kali. Kapan ya akutu beruntung dpt door prize dr shopee😌 https://t.co/3q4Sc0omzQ,Twitter for Android,1,0,sudah panen puluh puluh kali kapan ya akutu untung dpt door prize dr shopee
2020-05-04 05:14:22,1257071024870354944,ramdansyh180,"drama shopee,   golek sandangan murah” aa.  janji ga beli kaos item lagi,  diskon jdi 54k tapi tetep pilih warna item semua:)  cok goblok.",Twitter for iPhone,3,0,drama shopee golek sandang murah aa janji ga beli kaos item lagi diskon jdi 54k tapi tetep pilih warna item semua cok goblok
2020-05-04 05:14:21,1257071021661671424,baconbyn,"@horangah shopee gue gabisa buka story,,,, lo ngepost paan udh gue fb",Twitter for Android,0,0,shopee gue gabisa buka story lo ngepost paan udh gue fb
2020-05-04 05:14:12,1257070984005222400,brontauwa,Bantu siram tanamanku. Kamu juga bisa panen THR total 10M di Shopee sekarang! https://t.co/eqdnC5FmQD https://t.co/2o8sN3mIos,Twitter for Android,0,0,bantu siram tanam kamu juga bisa panen thr total 10m di shopee sekarang
2020-05-04 05:14:10,1257070977592070144,ThanapitDhamma4,"ขาย แผ่นกรองอากาศ  adapted for Amway Atmos2แผ่นHepaกรอบพลาสติก ในราคา ฿2,490 ใน #ShopeeTH ตอนนี้! https://t.co/1TCx6sMoXk https://t.co/zdm5itou8U",Twitter for Android,0,0,adapted for amway atmos2 hepa 2490
2020-05-04 05:14:09,1257070969648078848,wardah78540561,"Jaga Diri, Keluarga dan Orang Sekitar dari COVID-19! https://t.co/xf8Xz38NGC https://t.co/X77QPAfTuR",Shopee_ID,0,0,jaga diri keluarga dan orang sekitar dari covid19
2020-05-04 05:14:02,1257070940753522690,ailedraaa,@indiepemdent btw SHOPEE GW DAH GW APUS WKWKWKWKWK,Twitter Web App,0,0,btw shopee gw dah gw apus wkwkwkwkwk
2020-05-04 05:13:56,1257070918766964736,ummanyayaya,Bantu siram tanamanku. Kamu juga bisa panen THR total 10M di Shopee sekarang!  #Shopeetanam  https://t.co/LVwdkc9wEq https://t.co/ChRZABDhzA,Twitter for Android,0,0,bantu siram tanam kamu juga bisa panen thr total 10m di shopee sekarang
2020-05-04 05:13:56,1257070916837634048,cecejes,"Mau kukasih tips biar dapet ongkir gratis terus ga? Banyak2in akun shopee, aku ada 3 akun dan aktif semua. Dan vochernya tu beda2 gitu, jadi bisa gratis terus. Aku memang cerdas dalam hal menghambur2kan cuan, wowww",Twitter for iPhone,1,1,mau kasih tips biar dapet ongkir gratis terus ga banyak2in akun shopee aku ada 3 akun dan aktif semua dan vochernya tu beda2 gitu jadi bisa gratis terus aku memang cerdas dalam hal menghambur2kan cuan wowww
2020-05-04 05:13:53,1257070903067914241,imspecial_LKSoo,Bantu siram tanamanku. Kamu juga bisa panen THR total 10M di Shopee sekarang! https://t.co/BaCldNo93B https://t.co/ajwgmKHK7a,Shopee_ID,0,0,bantu siram tanam kamu juga bisa panen thr total 10m di shopee sekarang
2020-05-04 05:13:49,1257070887985012736,Susan9875665169,Post foto dengan #SalamLebaranShopee dan menangkan Uang Tunai Total 25 Juta Rupiah! https://t.co/WUzND14MYs{campaign_id}/1  @ShopeeID  #ShopeeID  #SalamLebaranShopee https://t.co/U9KL3Dzs6n,Twitter for Android,1,0,post foto dengan dan menang uang tunai total 25 juta rupiah
2020-05-04 05:13:48,1257070884965306375,idfckx,eu tô apaixonado apaixonada pelas langeries do shopee e eu só consigo pensar hmmm vou comprar isso aqui pra usar pra ela,Twitter for Android,0,0,eu t apaixonado apaixonada pelas langeries do shopee e eu s consigo pensar hmmm vou comprar isso aqui pra usar pra ela
2020-05-04 05:13:47,1257070878774321152,joferson_ramos,@TutoktowinGMA #tutoktowinathome #Shopee #Frontrow https://t.co/CDfFni6N51,Twitter for Android,0,0,
2020-05-04 05:13:47,1257070877826363392,TiensStore09,Saya menjual VITAMIN ZINC... seharga Rp145.000. Dapatkan produk ini hanya di Shopee! https://t.co/WSTPDg26tT #ShopeeID https://t.co/RVgJ2tzk63,Shopee_ID,0,0,saya jual vitamin zinc harga rp145000 dapat produk ini hanya di shopee
2020-05-04 05:13:45,1257070869383241729,panggilakunaya,@Asknonym https://t.co/ixAXolUPwf,Twitter for Android,0,1,
2020-05-04 05:13:33,1257070821627043841,supremezayn,sera q esse site shopee é seguro? pq as coisas são tão baratas lá,Twitter for Android,0,0,sera q esse site shopee seguro pq as coisas s o t o baratas l
2020-05-04 05:13:30,1257070806410031104,Sinta_Rahma22,kuy kuy Bantu siram tanamanku. Kamu juga bisa panen THR total 10M di Shopee sekarang! https://t.co/kGtfhON8H9,Twitter Web App,0,0,kuy kuy bantu siram tanam kamu juga bisa panen thr total 10m di shopee sekarang
2020-05-04 05:13:25,1257070786281721858,AjeerahZaharin,@syfqhzalzalah Kau beli mana di? Aku beli dekat shopee tapi guardian punya site lah hahaha nyesal pulak ey dah tahuuu pos laju problem lagi nak beli aduh,Twitter for iPhone,0,0,kau beli mana di aku beli dekat shopee tapi guardian punya site lah hahaha nyesal pulak ey dah tahuuu pos laju problem lagi nak beli aduh
2020-05-04 05:13:22,1257070774269050880,wardah78540561,"Jaga Diri, Keluarga dan Orang Sekitar dari COVID-19! https://t.co/xf8Xz38NGC https://t.co/sqaq62JlsG",Shopee_ID,0,0,jaga diri keluarga dan orang sekitar dari covid19
2020-05-04 05:13:17,1257070751363903489,TiensStore09,Saya menjual Pemutih Selur... seharga Rp12.000. Dapatkan produk ini hanya di Shopee! https://t.co/WQI3ncxIyy #ShopeeID https://t.co/wJHV8YRHv9,Shopee_ID,0,0,saya jual mutih selur harga rp12000 dapat produk ini hanya di shopee
2020-05-04 05:13:15,1257070743868727297,dreammenina,@coratcoretaku ni hyung https://t.co/dwW6oiWytF,Twitter for Android,0,0,ni hyung
2020-05-04 05:13:13,1257070737744990210,littlegamora,Anjir dah ngerasa dipermainkan sm shopee capit bgst,Twitter for Android,0,0,anjir dah ngerasa main sm shopee capit bgst
2020-05-04 05:13:11,1257070727393509376,Kevin07320844,"@ShopeeID halo kak, mau tanya saya ada transaksi di shopee yg salah input resi. Sudah lapor ke CS tp sudah 2 hari belum dirubah, mohon bantuannya. Ini nomor transaksi nya 200429RWQ7KTHQ, 17822360091 ini resi yg salah, 17822360097 ini resi yg benar.",Twitter for Android,0,0,halo kak mau tanya saya ada transaksi di shopee yg salah input resi sudah lapor ke cs tp sudah 2 hari belum rubah mohon bantu ini nomor transaksi nya 200429rwq7kthq 17822360091 ini resi yg salah 17822360097 ini resi yg benar
2020-05-04 05:13:02,1257070691704139778,ketiyash,Bantu siram tanamanku. Kamu juga bisa panen THR total 10M di Shopee sekarang! https://t.co/iYy93WyvcN https://t.co/DZ3smJcAWO,Shopee_ID,0,0,bantu siram tanam kamu juga bisa panen thr total 10m di shopee sekarang
2020-05-04 05:13:02,1257070690609426437,vandawpa,Saya menjual Maybelline Instant... seharga Rp0. Dapatkan produk ini hanya di Shopee! https://t.co/nwSuNVJC8h #ShopeeID https://t.co/yDlO80tdOx,Shopee_ID,0,0,saya jual maybelline instant harga rp0 dapat produk ini hanya di shopee
2020-05-04 05:12:54,1257070657273298944,ayikwp,Langsung siram balik... #Shopeetanam  Bantu siram tanamanku. Kamu juga bisa panen THR total 10M di Shopee sekarang! https://t.co/GIUxZvhAMN https://t.co/vN7gmRuJhP,Twitter for Android,0,0,langsung siram balik bantu siram tanam kamu juga bisa panen thr total 10m di shopee sekarang
2020-05-04 05:12:53,1257070650696466432,estehtarik_,tiap hari kerjaannya mantengin shopee tapi kaga ada yang dibeli mwehehe,Twitter for Android,0,0,tiap hari kerja mantengin shopee tapi kaga ada yang beli mwehehe
2020-05-04 05:12:43,1257070610179473409,asberrr_,@GAMEREFF https://t.co/4t5UwehuCs,Twitter for Android,0,0,
2020-05-04 05:12:41,1257070603078561793,joferson_ramos,@TutoktowinGMA #tutoktowinathome #Shopee #Frontrow https://t.co/RBfkhshyQI,Twitter for Android,0,0,
2020-05-04 05:12:40,1257070600079544321,nrlans02,@dyah_kemuning @Shopee_id @ShopeeID https://t.co/vetfwBto7O yuk siram yuk🌈,Twitter for Android,0,0,yuk siram yuk
2020-05-04 05:12:40,1257070599081299969,vioshlee,@ShopeeID @Shopee_id Bismillah #ShopeeTanamTHR10M #ShopeeDariRumah https://t.co/hHkTPrH8Oe,Twitter for Android,0,0,bismillah
2020-05-04 05:12:32,1257070564306325504,wardah78540561,"Jaga Diri, Keluarga dan Orang Sekitar dari COVID-19! https://t.co/xf8Xz38NGC https://t.co/cA2GmjrdHr",Shopee_ID,0,0,jaga diri keluarga dan orang sekitar dari covid19
2020-05-04 05:12:28,1257070549160693760,oekkaz,คำทำนายประจำสัปดาห์มาแล้วจ้า! รีบเข้าไปเช็คดวงกับ a ดวงกันได้เลย เพียงแชร์คำทำนายของคุณก็รับ COINS ไปเลย และนี่ก็คือคำทำนายของฉัน การงาน : 8/10 คะแนน บางท่านที่งานประจำก็จะแอบทำงานเสริม เพิ่มช่องทางหารายได้ แต่ยังไม่ได้อยากให้ใครรู้   #Shopeeดูดวง  https://t.co/7xBBXLv6cQ https://t.co/w4j21e6OCz,Twitter for Android,0,0,a coins 810
2020-05-04 05:12:17,1257070501077250049,lnpaa_,ช่วยรดน้ำให้เราหน่อย! #ShopeeFarmFromHome #รดมารดกลับ https://t.co/ipdCASgBXv https://t.co/Hng4HeiMch,Twitter for Android,0,0,
2020-05-04 05:12:02,1257070438296875008,Genpi_Co,Sarita Beauty sangat memahami keinginan para wanita Indonesia yang tetap ingin tampil cantik saat menjalani puasa Ramadan. #SaritaBeauty https://t.co/Tu6p7h22n2,genpico,0,0,sarita beauty sangat paham ingin para wanita indonesia yang tetap ingin tampil cantik saat jalan puasa ramadan
2020-05-04 05:11:58,1257070420177477632,nominchan,@yodreamfess nder mau kalo bisa shopee;,Twitter Web App,0,0,nder mau kalo bisa shopee
2020-05-04 05:11:56,1257070413017800704,joferson_ramos,@TutoktowinGMA #tutoktowinathome #Shopee #Frontrow https://t.co/6EMvPo1OoE,Twitter for Android,0,0,
2020-05-04 05:11:52,1257070397490528256,BarangSunnah,"I'm selling Hot Seller Pewangi Rumah, Kereta, ... for RM10.00. Get it on Shopee now! https://t.co/OkB2Xy2ytU #ShopeeMY https://t.co/YVMRTu5gn7",Shopee_MY,0,0,im selling hot seller wangi rumah kereta for rm1000 get it on shopee now
2020-05-04 05:11:43,1257070361130106880,pl34sure,@GAMEREFF https://t.co/9lpJlzYTEM,Twitter for Android,0,0,
2020-05-04 05:11:41,1257070350795370496,viinrs,Saya menjual Pharmaton Formula seharga Rp26.000. Dapatkan produk ini hanya di Shopee! https://t.co/bvlSOGb8wv #ShopeeID https://t.co/xzSG7mnJiY,Shopee_ID,0,0,saya jual pharmaton formula harga rp26000 dapat produk ini hanya di shopee
